Brand,Product Name,Rating,No. of Ratings,Discounted Price,Original Price,Discount,Offer Price
GUESS,Men Gold Eau De Toilette,3.8,10,"₹3,920","₹5,600",(30% off),"₹3,024"
POLICE,To Be Exotic Jungle Eau de Toilette - 125 ml,4.3,10,"₹2,665","₹4,100",(35% off),"₹2,091"
JEANNE ARTHES,Sexy Boy 2008 Eau de Toilette Pour Homme - 100 ml,N/A,N/A,"₹1,300","₹2,599",(50% off),"₹1,196"
4711,Acqua Colonia Blood Orange & Basil Eau De Cologne,4.7,6,"₹3,150","₹4,500",(30% off),"₹2,205"
MAMAEARTH,Pack of 2 Perfume Gift Set for Men,N/A,N/A,₹419,₹599,(30% off),₹317
FRENCH ESSENCE,Recharge Perfume for Men,N/A,N/A,₹399,N/A,N/A,₹279
Hackett,Essential Eau De Parfum,N/A,N/A,"₹3,920","₹4,900",(20% off),"₹3,038"
SET WET,Signature Eau de Parfum ICE for Men,N/A,N/A,₹599,N/A,N/A,₹524
AJMAL,Aurum Concentrated Perfume Oil Fruity Floral Alcohol-Free Attar For Women And Mizyaan Concentrated Perfume Oil Oriental Musky Alcohol-Free Attar For Unisex + 2 Parfum Testers,4.2,5,"₹2,380","₹2,975",(20% off),"₹1,755"
Jack & Jones,Jack & Jones Fragrance 75 ml,N/A,N/A,"₹1,799",N/A,N/A,"₹1,547"
Archies Parfum,Parfum 01 Parfum Original,4.1,25,₹499,N/A,N/A,₹364
The Man Company,Talc Eau De Parfum,3.7,24,₹270,₹599,(55% off),₹236
The Man Company,Ocean Eau De Parfum,3,17,₹270,₹599,(55% off),₹236
Ulric De Varens,Flash Eau de Toilette 100ml,3.6,10,₹999,"₹1,175",(15% off),₹752
Ramsons,Rhymes Eau De Parfum,3.1,9,₹175,N/A,N/A,₹145
Ramsons,Rhymes Eau De Parfum,3.1,9,₹175,N/A,N/A,₹145
Pilgrim,Alpha Eau De Parfum,3,4,₹777,"₹1,195",(35% off),₹544
Envy,Fiery Eau De Parfum,3.6,5,₹293,₹349,(16% off),₹206
Embark,Men Set of 3 Deodorants My Dream My Passion & My Story,N/A,N/A,₹693,"₹1,035",(33% off),₹580
AJMAL,Shiro EDP 90 ml,3.9,16,"₹2,800","₹3,500",(20% off),"₹2,030"
OMBRE BLISS,Men Marino Perfume,N/A,N/A,"₹1,079","₹1,199",(10% off),₹923
THE BODY SHOP,Blue Musk Zest Eau De Toilette,N/A,N/A,"₹2,595",N/A,N/A,"₹2,050"
POLICE,To Be Man Eau de Toilette - 125 ml,4.2,5,"₹2,925","₹3,900",(25% off),"₹2,301"
AZZARO,Pack of 3 Wanted Eau de Toilette Hair & Body Wash 2024 Gift Set,N/A,N/A,"₹8,500",N/A,N/A,"₹6,630"
PRADA,Luna Rossa Ocean Set Eau De Parfum & Travel Size Spray,N/A,N/A,"₹10,000",N/A,N/A,"₹8,000"
VILLAIN,On The Rocks Eau De Parfum for Men Premium Long-Lasting Mens Fragrance,N/A,N/A,₹360,₹799,(55% off),₹296
Layer'r,Men Shot Savage Parfum,N/A,N/A,₹639,₹799,(20% off),₹447
AJMAL,Patchouli Wood Eau De Parfum,5,2,"₹11,900","₹14,000",(15% off),"₹9,900"
AJMAL,Pack of 2 Ascend & Women & Neea For Women Edp Combo,N/A,N/A,"₹1,350","₹3,000",(55% off),₹990
JAGUAR,Ultimate Power Eau De Toilette,4.1,14,"₹2,665","₹4,100",(35% off),"₹2,091"
POLICE,Police Imperial Patchouli Eau de Toilette - 100 ml,N/A,N/A,"₹2,400","₹3,200",(25% off),"₹1,856"
RIFFWAY,Classic Bold and Timeless Unisex Perfume 20ML,N/A,N/A,₹220,₹999,(78% off),N/A
FASCZO,Men Bold and Masculine Fragrance,N/A,N/A,₹200,₹999,(80% off),N/A
GUESS,Seductive Eau De Toilette,3.3,7,"₹4,720","₹5,900",(20% off),"₹3,717"
CHOPARD,Leather Malaki Eau De Parfum for Men,N/A,N/A,"₹9,840","₹12,300",(20% off),"₹7,995"
AZZARO,Wanted Eau de Parfum and Hair & Body Wash 2024 Gift Set,N/A,N/A,"₹9,000",N/A,N/A,"₹7,020"
AJMAL,Pack of 2 Yearn Edp Combo For Men + 2 Parfum Testers,3.4,15,"₹1,350","₹3,000",(55% off),"₹1,050"
Bentley,Momentum Intense Eau de Perfum - 100 ml,N/A,N/A,"₹6,825","₹9,100",(25% off),"₹5,642"
AJMAL,235 EDP Oriental Perfume for Unisex,4.7,3,"₹8,800","₹11,000",(20% off),"₹6,800"
AZZARO,Wanted Eau De Toilette,4,2,"₹5,350",N/A,N/A,"₹3,959"
TOMMY HILFIGER,Impact Eau De Toilette for Men,N/A,N/A,"₹3,355","₹6,100",(45% off),"₹2,623"
M.Micallef,Royal Vintage Eau De Parfum,N/A,N/A,"₹20,680",N/A,N/A,"₹18,680"
The Man Company,Musk Eau De Parfum,3.8,38,₹650,"₹1,299",(50% off),₹569
JAGUAR,For Men Eau de Toilette - 100 ml,4.1,59,"₹2,460","₹4,100",(40% off),"₹1,927"
FOGG,Xpressio EDP Perfume,3,2,₹442,₹650,(32% off),₹429
METAMAN,Men Ha1o Day Fruity Extrait De Parfum,N/A,N/A,₹999,N/A,N/A,₹899
KENNETH COLE,Black Bond Perfumes & Colognes,3.7,3,"₹6,000",N/A,N/A,"₹4,440"
The Man Company,Classic Daily Kit,3.7,11,"₹1,319","₹2,198",(40% off),"₹1,011"
Beardo,Darkside And Godfather Eau De Parfum Set for Men,4.1,11,₹270,₹599,(55% off),₹236
The Man Company,Citron Eau De Parfum,3.7,25,₹824,"₹1,499",(45% off),₹705
AJMAL,Kuro Edp Aromatic Spicy Perfume For Men & Bastion Edp Woody Aromatic Perfume For Men + 2 Parfum Testers,5,2,"₹3,600","₹4,500",(20% off),"₹2,610"
Yardley London,Gentleman Royale Compact Perfume,4.1,28,₹643,₹649,(1% off),₹552
EDW Essenza,Mikkel Eau De Toilette,5,4,"₹3,002","₹3,950",(24% off),"₹2,291"
ENGAGE,L'amante Absolute Eau De Parfum For Man,4.2,11,₹859,₹999,(14% off),₹601
The Man Company,Set of 3 Privilege Intense with Bold & Active Body Sprays,3.9,54,₹475,₹897,(47% off),₹404
REPLAY,Signature Red Dragon Eau De Toilette,N/A,N/A,"₹3,430","₹4,900",(30% off),"₹2,695"
ADIDAS,Pure Game Eau De Toilette for Men,3.5,2,"₹1,319","₹1,499",(12% off),"₹1,049"
JAGUAR,Pace Eau de Toilette,4,5,"₹3,835","₹5,900",(35% off),"₹3,009"
AJMAL,Shiro Edp Citrus Spicy Perfume 90 ml For Men & Sacrifice Ii For Him Deodorant Fruity Aromatic Fragrance 200 ml For Men,3,2,"₹3,119","₹3,899",(20% off),"₹2,261"
The Man Company,Firewood Eau De Parfum,3.5,23,₹395,₹599,(34% off),₹335
The Man Company,Fire Eau De Parfum,3.5,4,₹412,₹749,(45% off),₹345
Bombay Shaving Company,Tokyo Premium Eau De Parfum for Men,N/A,N/A,₹342,₹795,(57% off),₹299
MARYAJ,Pebble Style eau de parfum - 100 ml,4,25,₹751,"₹1,669",(55% off),₹584
AJMAL,Pack of 3 Wisal Dhahab Deodorant Sprays,4.6,5,₹479,"₹1,197",(60% off),₹419
Embark,Men My Story for Him Spicy & Aquatic Luxury Eau De Parfum,3.8,18,₹608,₹845,(28% off),₹499
Jacques Bogart,Jacques Bogart Silver Scent Eau de Toilette -100 ml,4.2,5,"₹3,375","₹4,500",(25% off),"₹2,655"
RIFFWAY,Men  Fairy Floss Eau de Parfum,N/A,N/A,₹220,₹999,(78% off),N/A
POLICE,To Be Tattooart Eau de Toilette - 125 ml,3.9,19,"₹3,075","₹4,100",(25% off),"₹2,419"
HRX,Charge for Men Eau De Toilette,4,3,"₹1,520","₹1,900",(20% off),"₹1,140"
ADEN,Set of 6 Luxury Perfumes,2.7,6,"₹1,100",N/A,N/A,₹957
Tonino Lamborghini,Intenso Gift Set with Eau De Toilette & After Shave Balm,N/A,N/A,"₹2,500",N/A,N/A,"₹1,925"
The Man Company,TycoonLong-Lasting Fragrance Eau De parfum for Men,5,2,₹975,"₹2,499",(61% off),₹750
Dorall Collection,DC 4 U Eau de Toilette - 100 ml,N/A,N/A,₹300,₹599,(50% off),₹262
REPLAY,Eau de Toilette - 100 ml,N/A,N/A,"₹2,940","₹4,900",(40% off),"₹2,254"
ASPEN,Cologne for men Eau De Cologne for Men,N/A,N/A,"₹1,820","₹2,600",(30% off),"₹1,430"
AJMAL,Aristocrat Edp Citrus Woody Perfume For Men & Aurum Edp Fruity Floral Perfume For Women,3.7,3,"₹7,200","₹9,000",(20% off),"₹5,200"
Hackett,Essential Eau De Parfum,N/A,N/A,"₹5,520","₹6,900",(20% off),"₹4,278"
WILD STONE,Pack of 4 Cigar Ammo Night Rider & Edge Perfume Gift Set for Men,N/A,N/A,₹799,N/A,N/A,₹639
Hollister,Canyon Rush for Him Eau De Toilette,N/A,N/A,"₹3,185","₹4,900",(35% off),"₹2,646"
OLD SPICE,Atomizer Fresh Lime After Shave Lotion,N/A,N/A,₹325,N/A,N/A,₹284
Bentley,Infinite Rush Eau de Toilette,3.5,4,"₹4,575","₹6,100",(25% off),"₹3,477"
AZZARO,Chrome Eau De Toilette with Body Wash & Travel Size Spray,5,2,"₹6,000",N/A,N/A,"₹4,440"
VILLAIN,7 Deadly Scents Trial Pack of Pocket Liquid Perfume for Men,N/A,N/A,₹450,₹999,(55% off),₹370
The Man Company,Intense Eau De Parfum,4,64,₹714,"₹1,299",(45% off),₹624
AJMAL,Aristocrat Edp Citrus Woody Perfume 75 ml For Men & Zeal Edp Aquatic Woody Perfume 100 ml For Men,N/A,N/A,"₹5,600","₹7,000",(20% off),"₹4,480"
The Man Company,Triumph Eau De Toilette,2.8,4,₹494,₹899,(45% off),₹405
Mcaffeine,Fien 007 Perfume for Men Oriental Oud Eau de Parfum,3,2,₹692,₹899,(23% off),₹484
The Man Company,Oud Eau De Parfum,4,15,₹714,"₹1,299",(45% off),₹624
EDW Essenza,Inizio Aqua Homme Eau De Toilette,3.5,6,"₹2,242","₹2,950",(24% off),"₹1,741"
JAGUAR,Men Gold In Black Eau De Toilette,3,2,"₹2,665","₹4,100",(35% off),"₹2,091"
Mcaffeine,Fien Magnetic Perfume for Men Aquatic Eau de Parfum,N/A,N/A,₹692,₹899,(23% off),₹484
Beardo,Devil'S Oud Perfume Eau de Parfum for Men,N/A,N/A,"₹1,200","₹2,000",(40% off),"₹1,080"
VICTORINOX,Génépi Eau De Toilette,N/A,N/A,"₹4,970","₹7,100",(30% off),"₹4,189"
AJMAL,Wisal Dhahab Edp Fruity Floral Perfume For Men & Aurum Edp Fruity Floral Perfume For Women,5,2,"₹6,400","₹8,000",(20% off),"₹4,560"
S Oliver,For Him Eau De Toilette Natural Spray,5,3,"₹1,560","₹2,400",(35% off),"₹1,224"
COLOUR ME,Homme Blue Eau De Parfum,4.8,4,"₹1,600",N/A,N/A,"₹1,200"
DEMI DIEUS,Men Fresh Sea Luxery Perfume,N/A,N/A,₹345,"₹1,499",(77% off),₹319
DEMI DIEUS,Men Sweet and Warm Luxery Perfume,N/A,N/A,₹312,"₹1,249",(75% off),₹288
Cantabil,Cantabil Unisex Impulse Eau De Toilette Perfume,N/A,N/A,₹609,₹999,(39% off),₹533
Embark,Men My Dream for Him Woody & Marine Luxury Eau De Parfum,3,11,₹507,₹845,(40% off),₹431
ALFA ROMEO,Black Eau De Toilette,N/A,N/A,"₹1,750",N/A,N/A,"₹1,348"
COLOUR ME,Homme Oud Eau De Parfum,3,7,₹699,N/A,N/A,₹538
JAGUAR,Classic Red Eau de Toilette,3.5,2,"₹2,665","₹4,100",(35% off),"₹2,214"
AJMAL,Impress Concentrated Perfume Oil Citrus Alcohol-Free Attar For Men And Blu Homme Deodorant Aquatic Woody Fragrance For Men + 2 Parfum Testers,4.6,8,₹539,₹899,(40% off),₹441
John Varvatos,Men's XX Indigo Eau de Toilette for Men,N/A,N/A,"₹9,400",N/A,N/A,"₹7,400"
Hollister,Festival Nite for Him Eau De Toilette,N/A,N/A,"₹3,185","₹4,900",(35% off),"₹2,352"
SET WET,Signature Eau de Parfum FIRE for Women,N/A,N/A,₹599,N/A,N/A,₹524
JAGUAR,Classic Gold Eau De Toilette,N/A,N/A,"₹2,520","₹3,600",(30% off),"₹2,088"
NAUTICA,Eau de Toilette - 100 ml,3.2,5,"₹2,240","₹3,200",(30% off),"₹1,984"
AZZARO,The Most Wanted Eau de Toilette Intense Gift Set for Men,N/A,N/A,"₹10,350",N/A,N/A,"₹8,350"
Beardo,Pack of 3 Three Worlds of Oud Luxury Perfume Giftset Devil'S Oud Mortal Oud Divine Oud,N/A,N/A,₹549,₹999,(45% off),₹480
CHOPARD,Rose Malaki Eau De Parfum,N/A,N/A,"₹8,050","₹11,500",(30% off),"₹6,095"
Bentley,Absolute Eau De Parfum,3.7,3,"₹6,825","₹9,100",(25% off),"₹5,369"
CHOPARD,Amber Malaki Eau De Parfum,N/A,N/A,"₹9,775","₹11,500",(15% off),"₹7,775"
Clinique,Men Happy Eau De Cologne,N/A,N/A,"₹9,450",N/A,N/A,"₹7,450"
AJMAL,Kuro Edp Aromatic Spicy Perfume For Men & Shiro Edp Citrus Spicy Perfume For Men + 2 Parfum Testers,3.3,4,"₹5,200","₹6,500",(20% off),"₹3,770"
Brioni,Eau de Parfum,N/A,N/A,"₹9,265","₹10,900",(15% off),"₹7,265"
METAMAN,Men Ha1o Day Fresh Extrait De Parfum,N/A,N/A,₹999,N/A,N/A,₹899
ADEN,Aden Oasis Perfume Spray,N/A,N/A,"₹1,590","₹3,000",(47% off),"₹1,230"
ADEN,Aden Oud Bukhet Perfume Spray,3,2,"₹1,590","₹3,000",(47% off),"₹1,230"
Jack & Jones,Simply Iconic Eau De Toilette Perfume,3,2,"₹2,399","₹2,999",(20% off),"₹2,039"
The Souled Store,Black Panther The King Eau De Parfum,N/A,N/A,"₹1,004","₹1,499",(33% off),N/A
SENTIRE,Men Seductive Long Lasting Parfum,2.5,2,₹568,₹598,(5% off),₹490
NEESH,Glazed Water Extrait De Parfume,N/A,N/A,"₹4,491","₹4,990",(10% off),"₹4,242"
NEESH,Signature Scent Extrait De Parfume,N/A,N/A,"₹4,491","₹4,990",(10% off),"₹3,842"
Ustraa,Tattoo Cologne Perfume,4,44,₹575,₹899,(36% off),₹403
BALDESSARINI,Signature Eau De Toilette,N/A,N/A,"₹5,270","₹6,200",(15% off),"₹4,092"
RIFFWAY,Men  Rosy Pearl Perfume,N/A,N/A,₹220,₹999,(78% off),N/A
HRX,Edge for Men Eau De Toilette,3,4,"₹1,520","₹1,900",(20% off),"₹1,140"
TOMMY HILFIGER,Impact Spark Eau De Toilette for Men,N/A,N/A,"₹3,355","₹6,100",(45% off),"₹2,623"
EMANUEL UNGARO,Intense for Him Eau De Parfum,2.5,2,"₹3,640","₹5,200",(30% off),"₹2,756"
The Man Company,Eau De Toilette & Body Parfum Combo Kit,4,4,"₹1,429","₹2,598",(45% off),"₹1,117"
JAGUAR,Evolution Eau de Toilette -100 ml,3.9,11,"₹2,665","₹4,100",(35% off),"₹2,091"
AJMAL,Magnetize Concentrated Perfume for Men,3.4,11,₹450,₹500,(10% off),₹355
S Oliver,Eau De Toilette Natural Spray,3.5,11,"₹1,120","₹1,400",(20% off),₹966
Ramsons,Black Wallet Eau De Parfum,3.2,19,₹525,N/A,N/A,₹404
EDW Essenza,Mikkel Verde Eau De Toilette,4.1,8,₹607,₹799,(24% off),₹487
Archies Parfum,Parfum Dream Boyz Parfum Original,3.8,16,₹499,N/A,N/A,₹364
Ramsons,Brown Wallet Eau De Parfum,4,8,₹525,N/A,N/A,₹404
ENGAGE,XX5 Cologne Megapack,2.3,4,₹399,N/A,N/A,₹349
Beardo,Pack of 2 Power & Pride Long Lasting Deo Body Spray Combo For Men,N/A,N/A,₹216,₹698,(69% off),₹203
POLICE,Sport Eau De Toilette,4,4,"₹2,240","₹3,200",(30% off),"₹1,760"
COLOUR ME,Homme Green Eau De Parfum,N/A,N/A,"₹1,600",N/A,N/A,"₹1,200"
Ramsons,Cool Spark Eau De Parfum,3.6,8,₹175,N/A,N/A,₹145
FASCZO,Men Bold and Masculine Fragrance,N/A,N/A,₹600,"₹2,999",(80% off),₹555
Brioni,Eclat Eau De Parfum,N/A,N/A,"₹9,810","₹10,900",(10% off),"₹7,810"
AJMAL,Silver Shade Edp Citrus Woody Perfume For Men & Aurum Edp Fruity Floral Perfume For Women,N/A,N/A,"₹4,800","₹6,000",(20% off),"₹3,480"
NEUD,Pack of 3 Luxury Perfume Long Lasting Eau de Parfum Gift Set for Men,N/A,N/A,₹299,N/A,N/A,₹230
AJMAL,Titanium Edp Citrus Spicy Perfume For Men & Carbon Edp Citrus Spicy Perfume For Men + 2 Parfum Testers,N/A,N/A,"₹2,400","₹3,000",(20% off),"₹1,770"
JAGUAR,Stance Eau De Toilette,N/A,N/A,"₹2,660","₹3,800",(30% off),"₹2,090"
JAGUAR,Stance Eau De Toilette,N/A,N/A,"₹2,660","₹3,800",(30% off),"₹2,090"
Beverly Hills Polo Club,No.1 Sports Deodorant & Shower Cream Gift Set,N/A,N/A,₹879,"₹1,099",(20% off),₹747
JAGUAR,Jaguar Stance Eau de Toilette - 100 ml,3,2,"₹3,835","₹5,900",(35% off),"₹3,009"
Embark,Men My Life Eau De Parfum Shower Gel & Deodorant for Gift Set,N/A,N/A,₹868,"₹1,335",(35% off),₹708
AJMAL,Aristocrat Edp Citrus Woody Perfume  For Men And Blu Dreams Edp Citrus Fruity Perfume For Men  + 2 Parfum Testers,N/A,N/A,"₹4,639","₹5,799",(20% off),"₹3,479"
Archies Parfum,Parfum 01 Black Parfum Original,3.2,17,₹499,N/A,N/A,₹364
JAGUAR,for Men Prive Eau De Toilette,3,3,"₹2,665","₹4,100",(35% off),"₹2,214"
The Man Company,Polo Green Eau De Perfume,4.4,5,₹584,₹899,(35% off),₹485
AJMAL,Shiro Edp Citrus Spicy Perfume For Men Aurum Concentrated Perfume Oil Fruity Floral Alcohol-Free Attar For Women,N/A,N/A,"₹3,580","₹4,475",(20% off),"₹2,596"
Bombay Shaving Company,Gotham Eau De Perfume,N/A,N/A,"₹1,397","₹1,995",(30% off),"₹1,292"
MARYAJ,Maryaj Tuxedo Eau De Parfum Spicy Woody Perfume 100 ml For Men & Maryaj Wild Speed Eau De Parfum Citrus Spicy Perfume 100 ml For Men,N/A,N/A,"₹1,203","₹3,008",(60% off),₹902
The Man Company,Noire Eau De Toilette,N/A,N/A,"₹1,319","₹2,199",(40% off),"₹1,034"
Viktor & Rolf,Spicebomb Night Vision EDT Set,N/A,N/A,"₹9,350",N/A,N/A,"₹7,350"
Viktor & Rolf,Spicebomb Holiday Gift set,N/A,N/A,"₹9,775",N/A,N/A,"₹7,775"
RIFFWAY,Pack of 4 Unisex Eau De Parfums,N/A,N/A,₹840,"₹1,999",(58% off),₹740
RIFFWAY,Pack of 4 Unisex Eau De Parfums,N/A,N/A,₹840,"₹1,999",(58% off),₹740
DEMI DIEUS,Set of 2 Eau De Parfum Diva,N/A,N/A,₹261,₹899,(71% off),N/A
RIFFWAY,Aqua Men Eau de Parfum,N/A,N/A,₹270,₹999,(73% off),N/A
DEMI DIEUS,Set of 4 Men Eau De Parfume Gift Set,N/A,N/A,₹345,"₹1,499",(77% off),₹319
RIFFWAY,Men Perfume Combo Set of 4,N/A,N/A,₹840,"₹1,999",(58% off),₹740
Soul & Scents,Sandalwood Long Lasting,N/A,N/A,₹191,₹299,(36% off),₹150
Embark,Men My Life Eau De Parfum Face Wash & Shower Gel & Deodorant & Pouch Set,N/A,N/A,"₹2,211","₹2,730",(19% off),"₹1,693"
BALDESSARINI,Classic Black Eau De Toilette,N/A,N/A,"₹4,973","₹5,850",(15% off),"₹4,037"
Viktor & Rolf,Spicebomb Eau de Toilette Set for Men,N/A,N/A,"₹9,350",N/A,N/A,"₹7,350"
NEUD,Pack of 4 Luxury Perfume Long Lasting Eau de Parfum Gift Set for Men,N/A,N/A,₹399,N/A,N/A,₹299
AJMAL,Asher Concentrated Perfume Oil Oriental Alcohol-Free Attar For Unisex And Maryaj M For Her Eau De Parfum Fruity Floral Perfume For Women + 2 Parfum Testers,3,2,"₹1,973","₹2,819",(30% off),"₹1,438"
AJMAL,Zeal Edp Aquatic Woody Perfume For Men & Carbon Edp Citrus Spicy Perfume For Men + 2 Parfum Testers,4.4,7,"₹2,800","₹3,500",(20% off),"₹2,030"
AJMAL,Aristocrat Edp Citrus Woody Perfume For Men Aura Concentrated Perfume Oil Floral Fruity Alcohol-Free Attar For Unisex,N/A,N/A,"₹4,400","₹5,500",(20% off),"₹3,135"
CHOPARD,Chopard 1000 Miglia Eau de Toilette,N/A,N/A,"₹6,800","₹8,000",(15% off),"₹5,200"
Soul & Scents,"SOUL & SCENTS HFS /SS/BLAC_PO3, Onesize",N/A,N/A,₹191,₹299,(36% off),₹150
RIFFWAY,Men Angel Eau de Parfum,N/A,N/A,₹420,₹999,(58% off),₹367
Albatross,Best You Ever Had Eau De Parfum,4.5,2,"₹3,799",N/A,N/A,"₹3,647"
Matiere Premiere,Cologne Cedrat Eau de Perfume,N/A,N/A,"₹19,500",N/A,N/A,"₹17,500"
The Souled Store,Iron Man Billionaire Eau de Parfum,N/A,N/A,"₹1,004","₹1,499",(33% off),N/A
FW FAUN WALK,Charas For Men Similar to Hawaas 50 ML Perfume,N/A,N/A,₹675,"₹1,499",(55% off),₹555
Matiere Premiere,Matiere Premiere Radical Rose Eau de Parfum,N/A,N/A,"₹19,500",N/A,N/A,"₹17,500"
SENTIRE,Men Casanova Perfume,2.5,2,₹500,N/A,N/A,₹435
FW FAUN WALK,Luxe Ombre Similar To Ombre Leather By Tom ford-50 ml,3.8,10,"₹1,504","₹3,343",(55% off),"₹1,237"
Matiere Premiere,Men Parisian Musc,N/A,N/A,"₹19,500",N/A,N/A,"₹17,500"
NEESH,Luxe Mirage Extrait De Parfume,N/A,N/A,"₹5,391","₹5,990",(10% off),"₹4,612"
SENTIRE,Unisex LE Chocolate Exquisite Perfume,N/A,N/A,"₹3,999",N/A,N/A,"₹3,479"
METAMAN,Men Ha1o Day Oceanic Sports De Parfum,N/A,N/A,₹999,N/A,N/A,₹899
ADEN,Men Oud Elixir Perfume Spray,N/A,N/A,"₹1,590","₹3,000",(47% off),"₹1,230"
ADEN,Set of 11 Men Luxury Perfumes 8 ml,N/A,N/A,"₹2,100",N/A,N/A,"₹1,827"
POLICE,Frozen Eau de Toilette - 100 ml,2,5,"₹2,240","₹3,200",(30% off),"₹1,760"
POLICE,To Be Bad Guy Eau De Toilette for Man,3.6,7,"₹3,075","₹4,100",(25% off),"₹2,378"
FASCZO,Men Bold and Masculine Fragrance,N/A,N/A,₹200,₹999,(80% off),N/A
TOMMY HILFIGER,Impact Spark Eau De Toilette for Men,N/A,N/A,"₹4,455","₹8,100",(45% off),"₹3,726"
ROCHAS,L'Homme Eau De Toilette for Men,N/A,N/A,"₹7,500",N/A,N/A,"₹5,775"
AJMAL,Amber Musc EDP,N/A,N/A,"₹11,900","₹14,000",(15% off),"₹9,900"
FW FAUN WALK,Numero Uno For Women Similar to N5 50 ml,N/A,N/A,₹675,"₹1,499",(55% off),₹555
AJMAL,Kuro Edp Aromatic Spicy Perfume 90 ml For Men & Blu Homme Deodorant Aquatic Woody Fragrance 200 ml For Men,3.7,3,"₹2,719","₹3,399",(20% off),"₹1,971"
The Man Company,Privilege Legend with Bold & Intense Body Spray Set,3.8,14,₹396,₹747,(47% off),₹336
The Man Company,Set of 2 Privilege Legend & Bold Body Sprays,4.1,18,₹419,₹598,(30% off),₹335
SWISS ARMY,Forest Eau de Toilette Set - 100 ml + SG 100 ml,N/A,N/A,"₹5,530","₹7,900",(30% off),"₹3,871"
Archies Parfum,Parfum 01 Black Diamond Deo Combo,N/A,N/A,₹749,N/A,N/A,₹547
St.john,Cobra Limited Edition Eau De Parfum,2.3,6,₹407,₹550,(26% off),₹285
Berdoues,Men Somei Yoshino Eau De Perfume,N/A,N/A,"₹3,200",N/A,N/A,"₹2,784"
RIFFWAY,Lucky Star Eau De Parfum with Spicy Fragrance,N/A,N/A,₹270,₹999,(73% off),N/A
RIFFWAY,Dark Moment Perfume with Mysterious & Woody Aroma,N/A,N/A,₹270,₹999,(73% off),N/A
Soul & Scents,"SOUL & SCENTS HFS /SS/LAV_PO3, Onesize",N/A,N/A,₹191,₹299,(36% off),₹150
Bentley,Black Edition For Men Eau De Parfum - 100 ml,N/A,N/A,"₹6,825","₹9,100",(25% off),"₹5,642"
Mcaffeine,Fien Slow Kiss Perfume for Men Aromatic Fresh Eau de Parfum,4,2,₹692,₹899,(23% off),₹484
Dorall Collection,Lion Heart Eau de Toilette For Men - 100 ml,N/A,N/A,₹300,₹599,(50% off),₹262
AJMAL,Wisal Dhahab Edp Fruity Floral Perfume For Men And Blu Dreams Edp Citrus Fruity Perfume For Men  + 2 Parfum Testers,N/A,N/A,"₹3,839","₹4,799",(20% off),"₹2,879"
M.Micallef,Royal Vintage EDP,N/A,N/A,"₹10,030",N/A,N/A,"₹8,030"
Trussardi,Blue Vibe EDT,N/A,N/A,"₹8,700",N/A,N/A,"₹6,700"
AJMAL,Asher Concentrated Perfume Oil Oriental Alcohol-Free Attar For Unisex Khofooq Concentrated Perfume Oil Woody Oudhy Alcohol-Free Attar For Unisex,5,2,"₹2,600","₹3,250",(20% off),"₹1,885"
AZZARO,Chrome Set,N/A,N/A,"₹6,500",N/A,N/A,"₹4,810"
VINCE CAMUTO,Virtu Eau De Toilette,N/A,N/A,"₹6,000",N/A,N/A,"₹4,680"
RIFFWAY,Spirtz Eau De Parfum with Vanilla Fragrance,N/A,N/A,₹270,₹999,(73% off),N/A
DEMI DIEUS,Set of 2 Eau De Parfum,N/A,N/A,₹261,₹899,(71% off),N/A
DEMI DIEUS,Set of 2 Men Eau De Parfume,N/A,N/A,₹261,₹899,(71% off),N/A
RIFFWAY,Escada Sports Warm and Spicy Attraction 20ML,N/A,N/A,₹270,₹999,(73% off),N/A
FASCZO,Men Long lasting Premium Pack of 3,N/A,N/A,₹600,"₹2,999",(80% off),₹555
FASCZO,Men Long lasting Premium Pack of 1,N/A,N/A,₹200,₹999,(80% off),N/A
RIFFWAY,Pack of 4 Unisex Eau De Parfums,N/A,N/A,₹840,"₹1,999",(58% off),₹740
DEMI DIEUS,Set of 2 Men Eau De Parfume,N/A,N/A,₹261,₹899,(71% off),N/A
Soul & Scents,Set of 3 Citrus Home Fragrance Sachets,N/A,N/A,₹191,₹299,(36% off),₹150
RIFFWAY,Spritz Bloom Premium Natural Perfume,3,2,₹270,₹999,(73% off),N/A
RIFFWAY,Ocean Rush Unisex Eau de Parfum – Luxury Fragrance in 50ml,N/A,N/A,₹420,₹999,(58% off),₹367
DEMI DIEUS,Men Sweet and Warm Luxery Perfume,N/A,N/A,₹312,"₹1,249",(75% off),₹288
RIFFWAY,Men Perfume Combo Set of 4,N/A,N/A,₹840,"₹1,999",(58% off),₹740
RIFFWAY,Wild Rose 50ml Eau de Parfum,N/A,N/A,₹420,₹999,(58% off),₹367
Tonino Lamborghini,Classico Eau De Toilette,N/A,N/A,"₹2,900",N/A,N/A,"₹2,233"
REPLAY,Tank For Him Eau De Toilette,N/A,N/A,"₹2,640","₹4,400",(40% off),"₹2,068"
AJMAL,Bombay Dreams Edp Floral Fruity Perfume For Women And Kuro Edp Aromatic Spicy Perfume For Men + 2 Parfum Testers,4.4,5,"₹3,039","₹3,799",(20% off),"₹2,203"
ADEN,Men Mr President Perfume Spray,N/A,N/A,"₹1,590","₹3,000",(47% off),"₹1,230"
Mars & Venus,Men Eau De Premium Luxury Perfume - 100 ml,N/A,N/A,"₹3,149","₹3,499",(10% off),"₹2,694"
RIFFWAY,Men Rain 50ml Eau de Parfum,N/A,N/A,₹420,₹999,(58% off),₹367
RIFFWAY,Men Bouqet of Days Perfume - 50 ml,N/A,N/A,₹420,₹999,(58% off),₹367
RIFFWAY,Men The Old Spice Eau de Parfum 50 ml,N/A,N/A,₹420,₹999,(58% off),₹367
RIFFWAY,Secret Wish Eau de Parfum – 50ml Gender-Neutral Luxury Scent,N/A,N/A,₹420,₹999,(58% off),₹367
RIFFWAY,Sense Of Smell Perfume for Unisex,N/A,N/A,₹220,₹999,(78% off),N/A
RIFFWAY,Men Rain Perfume with Fruity Fragrance,N/A,N/A,₹270,₹999,(73% off),N/A
RIFFWAY,Men Perfume Natural Fragrance,N/A,N/A,₹220,₹999,(78% off),N/A
NEESH,Luxe Hayat Extrait De Parfume,N/A,N/A,"₹5,391","₹5,990",(10% off),"₹4,612"
NEESH,Cologne Sophistique Extrait De Parfume,N/A,N/A,"₹4,491","₹4,990",(10% off),"₹3,842"
SENTIRE,Men Deep Crush Long Lasting Parfum,N/A,N/A,₹466,₹490,(5% off),₹402
FW FAUN WALK,Lady Luck for Women Similar To Good Girl Perfume-50 ml,N/A,N/A,₹675,"₹1,499",(55% off),₹555
FW FAUN WALK,Bloombed for Women Similar to Flora 100 ml,N/A,N/A,"₹1,989","₹4,419",(55% off),"₹1,635"
NEESH,Luxe Aoud Extrait De Parfume,N/A,N/A,"₹5,391","₹5,990",(10% off),"₹4,612"
FW FAUN WALK,Celestial Noir Similar To Wanted By Night Perfume-50 ml,N/A,N/A,"₹1,504","₹3,343",(55% off),"₹1,237"
FW FAUN WALK,Men Oudessa Oudh Wood Luxury Perfume,N/A,N/A,"₹1,424","₹1,499",(5% off),"₹1,229"
FW FAUN WALK,Men Amber Sandalwood Similar to Le Mal Elixir Parfum,N/A,N/A,"₹1,424","₹1,499",(5% off),"₹1,229"
FW FAUN WALK,Purple Kush Oud Similar to Malaki Oud Perfume,N/A,N/A,"₹1,424","₹1,499",(5% off),"₹1,229"
ADEN,Men Mr President Perfume Spray,N/A,N/A,"₹1,590","₹3,000",(47% off),"₹1,230"
NAUTICA,Eau De Toilette - 100 ml,2.6,18,"₹1,920","₹3,200",(40% off),"₹1,760"
FASCZO,Dark Knight Men Perfume- Refreshing Woody & Spicy Scent 10ml,N/A,N/A,₹200,₹999,(80% off),N/A
FASCZO,Men Bold and Masculine Fragrance,N/A,N/A,₹200,₹999,(80% off),N/A
FASCZO,Men Bold and Masculine Fragrance,N/A,N/A,₹200,₹999,(80% off),N/A
RIFFWAY,Men Angel Involve Long-Lasting Perfume,N/A,N/A,₹220,₹999,(78% off),N/A
RIFFWAY,Men Paradise Eau de Parfum,N/A,N/A,₹220,₹999,(78% off),N/A
RIFFWAY,Men  Fairy Dust Premium Perfume Spray,N/A,N/A,₹220,₹999,(78% off),N/A
RIFFWAY,Men Long-Lasting Natural Fragrance Perfume-10 ml,N/A,N/A,₹220,₹999,(78% off),N/A
RIFFWAY,Men Long-Lasting Natural Fragrance,N/A,N/A,₹220,₹999,(78% off),N/A
FW FAUN WALK,Precious Perfume for Women Similar To Jadore Perfume-50 ml,N/A,N/A,₹675,"₹1,499",(55% off),₹555
TABAC,Original Eau De Cologne,4.2,5,"₹3,015","₹3,350",(10% off),"₹2,379"
PARK AVENUE,Eau De Parfum Premium Gift Kit For Men,5,3,"₹1,359","₹1,599",(15% off),"₹1,257"
EMANUEL UNGARO,Pour Homme 3 Eau De Toilette,4,3,"₹3,430","₹4,900",(30% off),"₹2,597"
NAUTICA,Men Voyage N-83 Eau De Toilette,2.1,45,"₹2,340","₹3,900",(40% off),"₹2,145"
Ustraa,After Dark Cologne Perfume,3.6,41,₹575,₹899,(36% off),₹403
Layer'r,Shot Maverick Men's Parfum,N/A,N/A,₹639,₹799,(20% off),₹447
The Man Company,Set of 2 Privilege Legend & Active Body Spray,3.3,12,₹349,₹498,(30% off),₹284
Layer'r,Shot Onyx Men's Parfum,N/A,N/A,₹639,₹799,(20% off),₹447
The Man Company,Men Everyday Use Travel Friendly Pocket Perfume Set,2.8,6,₹387,₹596,(35% off),₹328
EDW Essenza,Mikkel Eau De Toilette,3.7,3,₹607,₹799,(24% off),₹487
Tonino Lamborghini,Mitico Eau De Toilette,N/A,N/A,"₹2,900",N/A,N/A,"₹2,204"
