Brand,Product Name,Rating,No. of Ratings,Discounted Price,Original Price,Discount,Offer Price
ALFA ROMEO,Red Eau De Toilette,N/A,N/A,"₹2,500",N/A,N/A,"₹1,925"
Tonino Lamborghini,Acqua Eau De Toilette,N/A,N/A,"₹2,900",N/A,N/A,"₹2,233"
Tonino Lamborghini,Prestigio Eau De Toilette,N/A,N/A,"₹2,300",N/A,N/A,"₹1,771"
Tonino Lamborghini,Acqua Eau De Toilette,2,2,"₹2,300",N/A,N/A,"₹1,771"
Bombay Shaving Company,Red Spice & Black Vibe Body Spray for Men Combo,4.5,4,₹249,₹710,(65% off),₹218
RIFFWAY,Pack of 4 Unisex Eau De Parfums,N/A,N/A,₹840,"₹1,999",(58% off),₹740
TABAC,Original Eau de Cologne -100 ml,2,11,"₹1,440","₹1,600",(10% off),"₹1,152"
FRENCH ESSENCE,Pack of 4 Premium Black Luxury Perfume Gift Set for Men,N/A,N/A,₹749,N/A,N/A,₹652
TABAC,Original Eau De Cologne,3,6,₹903,₹950,(5% off),₹722
FRENCH ESSENCE,Pack of 4 Luxury Perfume Gift Set for Men,N/A,N/A,"₹1,399",N/A,N/A,"₹1,217"
Archies Parfum,Black Parfum Original & Black Deo Original,N/A,N/A,₹749,N/A,N/A,₹524
FRENCH ESSENCE,Pack of 2 Recharge Perfume & Deodorant Luxury Gift Set for Men,N/A,N/A,₹599,N/A,N/A,₹419
St.john,Cobra Live Limited Edition Deodorant Spray & Cool Cobra Eau De Parfum,N/A,N/A,₹610,₹718,(15% off),₹474
St.john,Cobra Cool & Sports Limited Edition Deodorant Spray,N/A,N/A,₹508,₹598,(15% off),₹356
Archies Parfum,Parfum Dream Boyz Parfum Original & Dream Boyz Deo Original,4.2,5,₹749,N/A,N/A,₹524
St.john,Cobra Real Man Parfum Body Spray,N/A,N/A,₹510,₹698,(27% off),₹357
FRENCH ESSENCE,Noir Perfume for Men,N/A,N/A,₹399,N/A,N/A,₹279
Whiskers,Midnight Eau De Parfum for Men,N/A,N/A,₹779,"₹1,199",(35% off),₹623
The Beard Story,Hero Eau De Parfum,N/A,N/A,₹974,"₹1,299",(25% off),₹682
ENGAGE,Yin Homme Eau De Parfum Giftbox,3.5,17,₹827,"₹1,198",(31% off),₹707
S,Your Moment Eau De Toilette,N/A,N/A,"₹1,800","₹2,400",(25% off),"₹1,416"
VISAKHA DAIRY,Men Beast X Spicy Swag Musky Macho & Cool Brute Deodorant Body Spray Set,N/A,N/A,₹690,N/A,N/A,₹524
ROCHAS,Man Eau De Toilette for Men,N/A,N/A,"₹7,200",N/A,N/A,"₹5,544"
St.john,Cobra Music & True Man Parfum Body Spray,N/A,N/A,₹510,₹698,(27% off),₹357
St.john,Cobra Live & Cool Deodorant Spray,N/A,N/A,₹410,₹500,(18% off),₹287
Ramsons,Secret Code Gift Pack,5,3,₹920,N/A,N/A,₹690
BOLD CARE,All Flavours Greek Gods Longest Lasting Eau De Parfum,3,3,₹589,₹999,(41% off),₹420
FRENCH ESSENCE,Pack of 4 Premium Blue Luxury Perfume Gift Set for Men,N/A,N/A,"₹1,399",N/A,N/A,"₹1,217"
Archies Parfum,Parfum Original & 01 Deo Original,3.8,4,₹749,N/A,N/A,₹524
RIFFWAY,Pack of 4 Unisex Eau De Parfums,N/A,N/A,₹840,"₹1,999",(58% off),₹740
RIFFWAY,Pack of 4 Unisex Eau De Parfums,N/A,N/A,₹840,"₹1,999",(58% off),₹740
RIFFWAY,Set of 4 Fragrance Set,N/A,N/A,₹740,"₹1,999",(63% off),₹647
DEMI DIEUS,Pack of 2 Men Eau De Parfume,N/A,N/A,₹261,₹899,(71% off),N/A
Soul & Scents,Scented Fable Fragrance,N/A,N/A,₹767,"₹1,199",(36% off),₹600
Soul & Scents,Soul Scents Blossom Potpourri,N/A,N/A,₹357,₹558,(36% off),₹279
ADEN,Mystic Tribe Luxury Attar,N/A,N/A,"₹1,590","₹3,000",(47% off),"₹1,230"
Soul & Scents,300 ml Reed Diffuser Refill For Automn Soul Fragrance,N/A,N/A,₹767,"₹1,199",(36% off),₹600
Soul & Scents,Reed Diffuser Set with 6 reed sticks,N/A,N/A,₹511,₹799,(36% off),₹400
Franck Olivier,Black Touch Eau de Toilette Spray,N/A,N/A,"₹2,400","₹3,200",(25% off),"₹1,952"
EMANUEL UNGARO,For Him Eau De Toilette,N/A,N/A,"₹3,430","₹4,900",(30% off),"₹2,597"
St.john,Cobra Cool & Live Deodorant Spray,N/A,N/A,₹490,₹598,(18% off),₹343
Cos-IQ,Emily In Paris Merci Eau De Parfum for Men,N/A,N/A,"₹1,499",N/A,N/A,"₹1,049"
Lyla Blanc,Urban Scent Luxury Gift Set For Men Perfume,N/A,N/A,₹599,N/A,N/A,₹461
Jacques Bogart,Silver Scent Intense Eau de Toilette - 100 ml,3.7,13,"₹3,000","₹5,000",(40% off),"₹2,350"
Viktor & Rolf,Spicebomb Set Eau De Toilette & Travel Size Spray,N/A,N/A,"₹8,800",N/A,N/A,"₹6,800"
COLOUR ME,Homme Abstract Art Eau De Parfum,2.5,2,"₹1,600",N/A,N/A,"₹1,200"
Soul & Scents,Soul Scents Ocean Potpourri,N/A,N/A,₹357,₹558,(36% off),₹279
Soul & Scents,Soul Scents Citrus Dream,N/A,N/A,₹357,₹558,(36% off),₹279
ADEN,Aden Mystic Tribe Luxury Attar-100ml,N/A,N/A,"₹1,590","₹3,000",(47% off),"₹1,230"
Berdoues,Men Guaria Morada Eau De Perfume,N/A,N/A,"₹3,200",N/A,N/A,"₹2,784"
SENTIRE,Men Casanova Perfume,N/A,N/A,"₹1,818",N/A,N/A,"₹1,582"
SENTIRE,Men Casanova Perfume,N/A,N/A,₹598,N/A,N/A,₹520
SOL,Pack of 2 Long-Lasting Perfumes,N/A,N/A,"₹3,499",N/A,N/A,"₹2,974"
Albatross,Leather Oud Ead De Parfum 100 ml,N/A,N/A,"₹3,999",N/A,N/A,"₹3,839"
SENTIRE,Sentire Deepcrush Eau De Parfum,N/A,N/A,"₹1,138","₹1,198",(5% off),₹875
SENTIRE,Men Sentire Exquisite Perfume,N/A,N/A,₹600,N/A,N/A,₹522
FW FAUN WALK,Men Garnet Smoke Long-Lasting Perfume,N/A,N/A,"₹2,374","₹2,499",(5% off),"₹2,049"
FW FAUN WALK,Women Bloombed Long-Lasting Perfume,N/A,N/A,"₹2,374","₹2,499",(5% off),"₹2,049"
SENTIRE,Men Sentire Bijou Perfume,N/A,N/A,"₹1,799",N/A,N/A,"₹1,565"
FW FAUN WALK,Men Long-Lasting Minimalist Perfume,N/A,N/A,₹664,₹699,(5% off),₹573
SENTIRE,Men Sentire O809 Perfume,N/A,N/A,"₹3,099",N/A,N/A,"₹2,696"
FW FAUN WALK,Men Richie Rich Perfume,N/A,N/A,"₹2,374","₹2,499",(5% off),"₹2,049"
ADEN,Men Oud Bukhet Luxury Attar,N/A,N/A,₹645,"₹1,500",(57% off),₹495
SENTIRE,Men Sentire Le Chocolate Perfume,N/A,N/A,"₹2,799",N/A,N/A,"₹2,435"
ADEN,Men Oud Aswad Luxury Attar,N/A,N/A,₹645,"₹1,500",(57% off),₹495
ADEN,Men Oud Elixir Luxury Attar,N/A,N/A,₹645,"₹1,500",(57% off),₹495
ADEN,Men Desert Rose Luxury Attar,N/A,N/A,₹645,"₹1,500",(57% off),₹495
ADEN,Men Cross Fit Perfume Spray,N/A,N/A,"₹1,590","₹3,000",(47% off),"₹1,230"
FASCZO,Sense Of Smell-A Timeless Men Bold and Magnetic Odour Control Perfume,N/A,N/A,₹200,₹999,(80% off),N/A
RIFFWAY,Dark Knight Eau De Parfum with Crisp & Citrusy Scent,N/A,N/A,₹270,₹999,(73% off),N/A
RIFFWAY,Blazer Man Eau De Parfum with Woody & Spicy Fragrance,N/A,N/A,₹270,₹999,(73% off),N/A
RIFFWAY,Men Touch Perfume 20 ML,N/A,N/A,₹270,₹999,(73% off),N/A
RIFFWAY,Men Perfume Fresh and Invigorating Aroma,N/A,N/A,₹270,₹999,(73% off),N/A
RIFFWAY,Muse Perfume Elegant and Sensual Unisex Perfume 20ML,N/A,N/A,₹270,₹999,(73% off),N/A
FASCZO,Men Bold and Masculine Fragrance,N/A,N/A,₹400,"₹1,999",(80% off),₹370
FASCZO,Men Long lasting Premium Pack of 2,N/A,N/A,₹400,"₹1,999",(80% off),₹370
FASCZO,Men Long lasting Premium Pack of 2,N/A,N/A,₹400,"₹1,999",(80% off),₹370
RIFFWAY,Men Perfume Collection Pack of 4,N/A,N/A,₹840,"₹1,999",(58% off),₹740
RIFFWAY,Enchantress Timeless Perfume - 10 ml,N/A,N/A,₹220,₹999,(78% off),N/A
RIFFWAY,"Bloom Unisex Fragrance - Bold and Elegant, 50ml EDP",N/A,N/A,₹420,₹999,(58% off),₹367
RIFFWAY,Men Long-Lasting Premium Perfume Gift Set,N/A,N/A,₹840,"₹1,999",(58% off),₹740
POLICE,To Be Goodvibes Eau De Toilette for Man,N/A,N/A,"₹3,280","₹4,100",(20% off),"₹2,665"
REPLAY,Tank Plate Eau de Toilette - 100 ml,N/A,N/A,"₹3,080","₹4,400",(30% off),"₹2,420"
RIFFWAY,Paradox Perfume A Scent of Strength and Elegance 20ML,N/A,N/A,₹270,₹999,(73% off),N/A
RIFFWAY,FireFly Perfume A Majestic Masculine Scent 20ML,N/A,N/A,₹270,₹999,(73% off),N/A
RIFFWAY,Pleasure Perfume Refreshing and Balanced Unisex Fragrance 20ML,N/A,N/A,₹270,₹999,(73% off),N/A
RIFFWAY,Ocean Rush Perfume Unisex Long-Lasting Fragrance 20ML,N/A,N/A,₹270,₹999,(73% off),N/A
ALFA ROMEO,Black Eau De Toilette,N/A,N/A,"₹2,500",N/A,N/A,"₹1,925"
POLICE,To Be Free To Dare For Men Eau de Toilette for Men,N/A,N/A,"₹3,075","₹4,100",(25% off),"₹2,542"
NEUD,Pack of 3 3-in-1 Perfumed Body Sprays for Men Long-Lasting No Gas No CFC,N/A,N/A,₹747,N/A,N/A,₹560
AJMAL,Blu Dreams Edp Citrus Fruity Perfume For Men & Wisal Dhahab Edp Fruity Floral Perfume For Men + 2 Parfum Testers,N/A,N/A,"₹3,839","₹4,799",(20% off),"₹3,071"
John Varvatos,Men's XX Indigo EDT for Men,N/A,N/A,"₹7,650",N/A,N/A,"₹5,814"
Trussardi,Uomo Eau De Toilette,N/A,N/A,"₹9,350",N/A,N/A,"₹7,350"
KENNETH COLE,Reaction Eau De Toilette,N/A,N/A,"₹6,000",N/A,N/A,"₹4,440"
AJMAL,Wisal Dhahab Edp Fruity Floral Perfume For Men & Silver Shade Homme Deodorant Citrus Woody Fragrance For Men+ 2 Parfum Testers,3.6,5,"₹3,519","₹4,399",(20% off),"₹2,551"
AJMAL,Blu Edp Aquatic Woody Perfume For Men & Neutron Edp Citrus Fruity Perfume For Men + 2 Parfum Testers,1.4,5,"₹3,600","₹4,500",(20% off),"₹2,880"
DEMI DIEUS,Men Sweet and Warm Luxery Perfume,N/A,N/A,₹345,"₹1,499",(77% off),₹319
RIFFWAY,Men Cabret Perfume The Royal Fruity Fragrance 20ML,N/A,N/A,₹270,₹999,(73% off),N/A
RIFFWAY,Dynamo Eau De Parfum with Vanilla Fragrance,N/A,N/A,₹270,₹999,(73% off),N/A
RIFFWAY,Firefly Men's Perfume Intense and Captivating Scent 20ml,N/A,N/A,₹270,₹999,(73% off),N/A
DEMI DIEUS,Set of 2 Men Eau De Parfume,N/A,N/A,₹261,₹899,(71% off),N/A
DEMI DIEUS,Set of 4 Men Eau De Parfume,N/A,N/A,₹345,"₹1,499",(77% off),₹319
DEMI DIEUS,Set of 2 Men Eau De Parfume,N/A,N/A,₹261,₹899,(71% off),N/A
DEMI DIEUS,Set of 2 Men Eau De Parfume,N/A,N/A,₹261,₹899,(71% off),N/A
RIFFWAY,Splash Eau de Parfum Mysterious and Alluring Fragrance 20ml,N/A,N/A,₹270,₹999,(73% off),N/A
RIFFWAY,Escada Sports Eau De Parfum with Aromatic Fragrance,N/A,N/A,₹270,₹999,(73% off),N/A
RIFFWAY,Men Eau de Perfume Pack Of 3,N/A,N/A,₹780,"₹2,999",(74% off),₹721
RIFFWAY,Amythyst Perfume Unisex Perfume 20ML,N/A,N/A,₹270,₹999,(73% off),N/A
DEMI DIEUS,Pack of 2 Men Eau De Parfume,N/A,N/A,₹261,₹899,(71% off),N/A
DEMI DIEUS,Set of 2 Men Eau De Parfume,N/A,N/A,₹261,₹899,(71% off),N/A
DEMI DIEUS,Set of 2 Men Eau De Parfume,N/A,N/A,₹261,₹899,(71% off),N/A
DEMI DIEUS,Set of 2 Eau De Parfum,N/A,N/A,₹261,₹899,(71% off),N/A
RIFFWAY,Blue Rush Eau de Parfum for Men 20ml,N/A,N/A,₹270,₹999,(73% off),N/A
FASCZO,Men Bold and Masculine Fragrance,N/A,N/A,₹400,"₹1,999",(80% off),₹370
FASCZO,Men Long lasting Premium Pack of 2,N/A,N/A,₹400,"₹1,999",(80% off),₹370
FASCZO,Men Long lasting Premium Pack of 3,N/A,N/A,₹600,"₹2,999",(80% off),₹555
FASCZO,Men Long lasting Premium Pack of 3,N/A,N/A,₹600,"₹2,999",(80% off),₹555
FASCZO,Men Long lasting Premium Pack of 3,N/A,N/A,₹600,"₹2,999",(80% off),₹555
RIFFWAY,Citrus Twist Perfume for Men Musky & Alluring Aroma 20ml,N/A,N/A,₹270,₹999,(73% off),N/A
FASCZO,Men Bold and Masculine Fragrance,N/A,N/A,₹600,"₹2,999",(80% off),₹555
FASCZO,Men Bold and Masculine Fragrance,N/A,N/A,₹400,"₹1,999",(80% off),₹370
RIFFWAY,Men Bold and Mysterious Scent,N/A,N/A,₹780,"₹2,999",(74% off),₹721
RIFFWAY,Carbet Men Intense & Seductive Scent,N/A,N/A,₹270,₹999,(73% off),N/A
FASCZO,Men Bold and Masculine Fragrance,N/A,N/A,₹400,"₹1,999",(80% off),₹370
RIFFWAY,Men Bold and Mysterious Scent,N/A,N/A,₹540,"₹1,999",(73% off),₹499
RIFFWAY,Eau De Parfum Paradox 20ml Pocket Perfume for Men,N/A,N/A,₹250,₹999,(75% off),N/A
FASCZO,Men Long lasting Premium Pack of 1,N/A,N/A,₹200,₹999,(80% off),N/A
FASCZO,Men Long lasting Premium Pack of 2,N/A,N/A,₹400,"₹1,999",(80% off),₹370
FASCZO,Men Bold and Masculine Fragrance,N/A,N/A,₹600,"₹2,999",(80% off),₹555
FASCZO,Men Bold and Masculine Fragrance,N/A,N/A,₹400,"₹1,999",(80% off),₹370
FASCZO,Men Bold and Magnetic Odour Control Perfume,N/A,N/A,₹200,₹999,(80% off),N/A
RIFFWAY,Eau De Parfum Timeless Poision 20ml Intense Fragrance for Men,N/A,N/A,₹250,₹999,(75% off),N/A
RIFFWAY,Eau De Parfum 20ml Europhia Spray for Men,N/A,N/A,₹250,₹999,(75% off),N/A
DEMI DIEUS,Set of 2 Men Eau De Parfume,N/A,N/A,₹261,₹899,(71% off),N/A
DEMI DIEUS,Set of 2 Men Eau De Parfume,N/A,N/A,₹261,₹899,(71% off),N/A
DEMI DIEUS,Set of 2 Men Eau De Parfume,N/A,N/A,₹261,₹899,(71% off),N/A
DEMI DIEUS,Pack of 2 Men Eau De Parfume,N/A,N/A,₹261,₹899,(71% off),N/A
DEMI DIEUS,Set of 4 Men Eau De Parfume Gift Set,N/A,N/A,₹345,"₹1,499",(77% off),₹319
RIFFWAY,Desert Nights Unisex Eau de Parfum,N/A,N/A,₹270,₹999,(73% off),N/A
RIFFWAY,Perfume-50 ml,N/A,N/A,₹420,₹999,(58% off),₹367
RIFFWAY,Men Fairy Dust Eau de Perfum Spray 20ml,N/A,N/A,₹270,₹999,(73% off),N/A
RIFFWAY,Angel Long Lasting Perfume - 10 ml,N/A,N/A,₹220,₹999,(78% off),N/A
Mars & Venus,Men Eau De Premium Luxury Perfume - 100 ml,N/A,N/A,"₹2,699","₹2,999",(10% off),"₹2,309"
Mars & Venus,Men Eau De Premium Luxury Perfume - 100 ml,N/A,N/A,"₹2,699","₹2,999",(10% off),"₹2,309"
RIFFWAY,Men Angel Perfume Long-Lasting Natural Fragrance,N/A,N/A,₹220,₹999,(78% off),N/A
RIFFWAY,Paradise 50ml Unisex Perfume – Elegance in Every Spray,N/A,N/A,₹270,₹999,(73% off),N/A
RIFFWAY,Aqua Beauty Eau de Parfum - Unisex Luxury Scent in 50ml Bottle,N/A,N/A,₹420,₹999,(58% off),₹367
Mars & Venus,Men Long-Lasting Eau de Parfurm 100ml,N/A,N/A,"₹2,699","₹2,999",(10% off),"₹2,309"
RIFFWAY,Eterna Desire Unisex Eau de Parfum - 50ml,N/A,N/A,₹420,₹999,(58% off),₹367
OMBRE BLISS,Men Alchol Denat Long-Lasting Perfume 100ml,N/A,N/A,"₹1,079","₹1,199",(10% off),₹923
RIFFWAY,Dynamo Perfume Spray Luxury Fragrance for Men,N/A,N/A,₹220,₹999,(78% off),N/A
RIFFWAY,Angel Eau de Parfum for Women,N/A,N/A,₹220,₹999,(78% off),N/A
OMBRE BLISS,Set of 4 Men Long-Lasting Perfume 100ml,N/A,N/A,"₹1,259","₹1,399",(10% off),"₹1,077"
RIFFWAY,Men Fragrance Set Set of 4,N/A,N/A,₹840,"₹1,999",(58% off),₹740
RIFFWAY,Men Angel Mr. Right Long-Lasting Perfume,N/A,N/A,₹220,₹999,(78% off),N/A
RIFFWAY,Men Angel Eternal Desire Long-Lasting Perfume,N/A,N/A,₹220,₹999,(78% off),N/A
Soul & Scents,"SOUL & SCENTS HFS /SS/JAS_PO3, Onesize",N/A,N/A,₹191,₹299,(36% off),₹150
RIFFWAY,Perfume-50 ml,N/A,N/A,₹420,₹999,(58% off),₹367
RIFFWAY,Dynamo Essence Floral Perfume,N/A,N/A,₹270,₹999,(73% off),N/A
RIFFWAY,Sense Of Smell Unisex Perfume,N/A,N/A,₹270,₹999,(73% off),N/A
RIFFWAY,Unisex The King Perfume,N/A,N/A,₹270,₹999,(73% off),N/A
RIFFWAY,Timeless Poison Infused Perfume,N/A,N/A,₹270,₹999,(73% off),N/A
AJMAL,Khofooq Concentrated Perfume Oil Woody Oudhy Alcohol-Free Attar For Unisex & Maryaj Wild Speed Eau De Parfum Citrus Spicy Perfume For Men,N/A,N/A,"₹2,671","₹3,339",(20% off),"₹1,937"
RIFFWAY,Men Angel Cube Long-Lasting Perfume,N/A,N/A,₹220,₹999,(78% off),N/A
RIFFWAY,Men Long-Lasting Natural Fragrance,N/A,N/A,₹220,₹999,(78% off),N/A
RIFFWAY,Men Involve Radiance Eau de Parfum,N/A,N/A,₹220,₹999,(78% off),N/A
RIFFWAY,Men Strictly Feminine Eau de Parfum,N/A,N/A,₹420,₹999,(58% off),₹367
RIFFWAY,Men Involve Perfume Spray - 50 ml,N/A,N/A,₹420,₹999,(58% off),₹367
RIFFWAY,Men Long-Lasting Natural Fragrance Perfume-10 ml,N/A,N/A,₹220,₹999,(78% off),N/A
RIFFWAY,Desert King Perfume,N/A,N/A,₹220,₹999,(78% off),N/A
RIFFWAY,Unisex Long-Lasting Fragrance,N/A,N/A,₹420,₹999,(58% off),₹367
RIFFWAY,Rain Eau de Parfum - 10 ml,N/A,N/A,₹220,₹999,(78% off),N/A
RIFFWAY,Men Angel Perfume Long-Lasting Natural Fragrance,N/A,N/A,₹220,₹999,(78% off),N/A
RIFFWAY,Men  Blossom Rose Fragrance,N/A,N/A,₹220,₹999,(78% off),N/A
RIFFWAY,Men Sweet Cheery Perfume,N/A,N/A,₹270,₹999,(73% off),N/A
RIFFWAY,Men Chamomile Bliss Perfume,N/A,N/A,₹270,₹999,(73% off),N/A
RIFFWAY,Men Bloom Perfume,N/A,N/A,₹220,₹999,(78% off),N/A
RIFFWAY,Men Fairy Dust Perfume,N/A,N/A,₹420,₹999,(58% off),₹367
RIFFWAY,Men Perfume Natural Fragrance,N/A,N/A,₹220,₹999,(78% off),N/A
FW FAUN WALK,Richie Rich For men Similar to 1M 50 ML Perfume,N/A,N/A,"₹1,424","₹1,499",(5% off),"₹1,229"
FW FAUN WALK,Marrakesh Mist Similar To Tam Dao Perfume-100 ml,N/A,N/A,"₹2,374","₹2,499",(5% off),"₹2,049"
FW FAUN WALK,Men Long-Lasting Perfume,N/A,N/A,"₹2,374","₹2,499",(5% off),"₹2,049"
FW FAUN WALK,Men Celestial Noir Parfum,N/A,N/A,"₹1,424","₹1,499",(5% off),"₹1,229"
FW FAUN WALK,Men Saffron Oud Perfume,N/A,N/A,"₹1,424","₹1,499",(5% off),"₹1,229"
FW FAUN WALK,Men Azura Long-Lasting Perfume,N/A,N/A,"₹2,374","₹2,499",(5% off),"₹2,049"
Matiere Premiere,Men Bois D'ebene,N/A,N/A,"₹19,500",N/A,N/A,"₹17,500"
SENTIRE,Casanova Fruity Long Lasting Perfume,N/A,N/A,₹568,₹598,(5% off),₹490
FW FAUN WALK,Men Long-Lasting Perfume,N/A,N/A,"₹2,374","₹2,499",(5% off),"₹2,049"
FW FAUN WALK,Men Celestial Noir Parfum,N/A,N/A,"₹1,424","₹1,499",(5% off),"₹1,229"
FW FAUN WALK,Long Lasting Fresh Perfume,N/A,N/A,₹664,₹699,(5% off),₹573
SENTIRE,Men Sentire White Oud Perfume,N/A,N/A,₹800,N/A,N/A,₹696
FW FAUN WALK,Unisex Long Lasting Fresh Perfume,N/A,N/A,₹664,₹699,(5% off),₹573
SENTIRE,Men Sentire O809 Perfume,N/A,N/A,₹800,N/A,N/A,₹696
FW FAUN WALK,Men Azura Long-Lasting Perfume,N/A,N/A,"₹2,374","₹2,499",(5% off),"₹2,049"
RIFFWAY,Enchanting Floral Fragrance for Special Moments,N/A,N/A,₹220,₹999,(78% off),N/A
RIFFWAY,Knight Fragrance Perfume,N/A,N/A,₹220,₹999,(78% off),N/A
RIFFWAY,Wild Rose Essence Perfectly Sweet,N/A,N/A,₹220,₹999,(78% off),N/A
RIFFWAY,Trillium Perfume for Unisex,N/A,N/A,₹220,₹999,(78% off),N/A
The Man Company,Set of 4 Active Legend Intense & Bold Body Spray,2.9,51,₹598,₹996,(40% off),₹488
Pilgrim,Zen Eau De Parfum,N/A,N/A,₹777,"₹1,195",(35% off),₹544
RIFFWAY,Men Eau De Perfume with Premium Masculine Notes,N/A,N/A,₹250,₹999,(75% off),N/A
RIFFWAY,Set of 4 Unisex Perfumes,N/A,N/A,₹840,"₹1,999",(58% off),₹740
RIFFWAY,Men Bold and Mysterious Scent,N/A,N/A,₹540,"₹1,999",(73% off),₹499
RIFFWAY,Men Perfume Set 4,N/A,N/A,₹840,"₹1,999",(58% off),₹740
St.john,Cobra Men Embrace Eau De Parfum,N/A,N/A,"₹1,399","₹1,998",(30% off),₹979
RIFFWAY,Set of 4 Fragrance Set,N/A,N/A,₹740,"₹1,999",(63% off),₹647
BOLD CARE,Hades Scotch and Smoke Longest Lasting Eau De Parfum,N/A,N/A,₹503,₹899,(44% off),₹369
Archies Parfum,Parfum Ghost Parfum Black Original,3.8,5,₹499,N/A,N/A,₹364
VISAKHA DAIRY,BEAST - X Emperor Luxury Exotic Perfume for Men,N/A,N/A,₹499,N/A,N/A,₹394
VISAKHA DAIRY,BEAST - X Empire Luxury Perfume Set for Men,N/A,N/A,₹849,N/A,N/A,₹637
St.john,Cobra Sports & Cool Limited Edition Deodorant Spray,N/A,N/A,₹718,N/A,N/A,₹539
DEMI DIEUS,Set of 2 Eau De Parfum,N/A,N/A,₹261,₹899,(71% off),N/A
DEMI DIEUS,Pack of 2 Men Eau De Parfume,N/A,N/A,₹261,₹899,(71% off),N/A
DEMI DIEUS,Pack of 2 Men Eau De Parfume,N/A,N/A,₹261,₹899,(71% off),N/A
RIFFWAY,Men Long-Lasting Premium Perfume Gift Set,N/A,N/A,₹840,"₹1,999",(58% off),₹740
DEMI DIEUS,Set of 2 Eau De Parfum Bold,N/A,N/A,₹261,₹899,(71% off),N/A
RIFFWAY,Pack of 3 Eau De Parfum 60ml Cabret Mens Perfume,N/A,N/A,₹780,"₹2,999",(74% off),₹721
RIFFWAY,Capivating Musk Premium 40ml Eau de Parfum for Men,N/A,N/A,₹500,"₹1,999",(75% off),₹462
RIFFWAY,Pack of 2 Eau De Parfum 40ml Cocoblue Mens Perfume,N/A,N/A,₹500,"₹1,999",(75% off),₹462
RIFFWAY,Set of 4 Unisex Eau De Parfums-80 ml,N/A,N/A,₹740,"₹1,999",(63% off),₹647
DEMI DIEUS,Set of 2 Eau De Perfume,N/A,N/A,₹261,₹899,(71% off),N/A
DEMI DIEUS,Set of 2 Men Eau De Parfume,N/A,N/A,₹261,₹899,(71% off),N/A
RIFFWAY,Liquid Disco 50ml Fragrance,N/A,N/A,₹420,₹999,(58% off),₹367
RIFFWAY,Cube Eau de Parfum,N/A,N/A,₹420,₹999,(58% off),₹367
RIFFWAY,Men Perfume Collection Set of 4,N/A,N/A,₹840,"₹1,999",(58% off),₹740
Soul & Scents,Reed Diffuser Refill Fiber Reed Sticks,N/A,N/A,₹767,"₹1,199",(36% off),₹600
RIFFWAY,Men Spring Long Lasting Perfume,N/A,N/A,₹420,₹999,(58% off),₹367
BLUE,Blue Deodorant Body Spray,N/A,N/A,₹718,₹897,(20% off),₹511
BOLD CARE,Ares Longest Lasting Eau De Parfum Oud for Men,N/A,N/A,₹503,₹899,(44% off),₹405
RIFFWAY,Blossom Eau de Parfum for Women,N/A,N/A,₹390,₹999,(61% off),₹341
SENTIRE,Men Casanova Perfume,N/A,N/A,"₹1,318",N/A,N/A,"₹1,147"
Berdoues,Men Somei Yoshino Eau De Perfume,N/A,N/A,"₹9,000",N/A,N/A,"₹7,830"
SENTIRE,Casanova Fruity Long Lasting Perfume,N/A,N/A,₹646,₹680,(5% off),₹558
SENTIRE,Sentire Casanova Eau De Parfum,N/A,N/A,"₹1,727","₹1,818",(5% off),"₹1,491"
Berdoues,Men Assam Of India Eau De Perfume,N/A,N/A,"₹9,000",N/A,N/A,"₹7,830"
SENTIRE,Casanova Fruity Long Lasting Perfume,N/A,N/A,"₹1,461","₹1,538",(5% off),"₹1,261"
FW FAUN WALK,Women Faunwalk Long Lasting Perfumes 20-ml,N/A,N/A,₹664,₹699,(5% off),₹573
SENTIRE,Sentire O809 Perfume,N/A,N/A,"₹2,418",N/A,N/A,"₹2,104"
SENTIRE,Men Sentire Mirai Perfume,N/A,N/A,"₹3,999",N/A,N/A,"₹3,479"
SENTIRE,Men Sentire Dapper Perfume,N/A,N/A,"₹1,849",N/A,N/A,"₹1,609"
FW FAUN WALK,Unisex Lady Luck Good Girl Perfume,N/A,N/A,"₹2,374","₹2,499",(5% off),"₹2,049"
SENTIRE,Men Sentire Reiz Perfume,N/A,N/A,"₹3,099",N/A,N/A,"₹2,696"
FW FAUN WALK,"Toxicity For Her Similar to ""D Poison""Amazing Perfume",N/A,N/A,"₹2,374","₹2,499",(5% off),"₹2,049"
FW FAUN WALK,Velvet Veil Similar to Jazz Club Perfume,N/A,N/A,"₹1,424","₹1,499",(5% off),"₹1,229"
FW FAUN WALK,Men Calabrian Blue Parfum,N/A,N/A,"₹1,424","₹1,499",(5% off),"₹1,229"
SENTIRE,Men Sentire Deep Crush Perfume,N/A,N/A,₹600,N/A,N/A,₹522
FW FAUN WALK,White Woods For Women Similar to Romance Perfume,N/A,N/A,"₹2,374","₹2,499",(5% off),"₹2,049"
FW FAUN WALK,Men Moksha Elysium Perfume,N/A,N/A,"₹2,374","₹2,499",(5% off),"₹2,049"
SENTIRE,Men Sentire Seductive Perfume,N/A,N/A,"₹1,538",N/A,N/A,"₹1,338"
SENTIRE,Men Sentire Personna Perfume,N/A,N/A,₹600,N/A,N/A,₹522
FW FAUN WALK,Men Irish Wood Parfum,N/A,N/A,"₹1,424","₹1,499",(5% off),"₹1,229"
FW FAUN WALK,Men Ocean's Blu Cool Water,N/A,N/A,"₹1,424","₹1,499",(5% off),"₹1,229"
FW FAUN WALK,"""You"" Similar to Invictus Perfume for Men Perfume",N/A,N/A,"₹1,424","₹1,499",(5% off),"₹1,229"
FW FAUN WALK,Men Bulgarian Oud Long-Lasting Perfume,N/A,N/A,"₹1,424","₹1,499",(5% off),"₹1,229"
ADEN,Aden Desert Rose Perfume Spray,N/A,N/A,"₹1,590","₹3,000",(47% off),"₹1,230"
FASCZO,Men Long lasting Premium Pack of 1,N/A,N/A,₹200,₹999,(80% off),N/A
RIFFWAY,Women Wild Rose Perfume Long Lasting Perfume,N/A,N/A,₹220,₹999,(78% off),N/A
FASCZO,Men Long lasting Premium Pack of 1,N/A,N/A,₹200,₹999,(80% off),N/A
FASCZO,Men Long lasting Premium Pack of 1,N/A,N/A,₹200,₹999,(80% off),N/A
FASCZO,Men Bold and Masculine Fragrance,N/A,N/A,₹200,₹999,(80% off),N/A
FASCZO,Men Long lasting Premium Pack of 1,N/A,N/A,₹200,₹999,(80% off),N/A
RIFFWAY,Men Angel Perfume Long-Lasting Natural Fragrance,N/A,N/A,₹220,₹999,(78% off),N/A
RIFFWAY,The Kung Luxe Perfume,N/A,N/A,₹220,₹999,(78% off),N/A
RIFFWAY,Fairy Dust Fragrance For the Woman Who Loves to Blossom,N/A,N/A,₹220,₹999,(78% off),N/A
RIFFWAY,Men Perfume Natural Fragrance,N/A,N/A,₹220,₹999,(78% off),N/A
FASCZO,Men Bold and Masculine Fragrance,N/A,N/A,₹200,₹999,(80% off),N/A
RIFFWAY,Eternal Floral Perfume  Classic Fragrance,N/A,N/A,₹220,₹999,(78% off),N/A
The Man Company,Set of 2 Privilege Bold & Intense Body Spray,3.6,16,₹349,₹498,(30% off),₹279
FASCZO,Pack of 2 Odour Control Smoky Perfume,N/A,N/A,₹400,"₹1,999",(80% off),₹370
RIFFWAY,Men Bold and Mysterious Scent,N/A,N/A,₹780,"₹2,999",(74% off),₹721
RIFFWAY,Perfume Gift Set for Men Pack of 4,N/A,N/A,₹840,"₹1,999",(58% off),₹740
RIFFWAY,Men Long-Lasting Premium Perfume Gift Set,N/A,N/A,₹840,"₹1,999",(58% off),₹740
RIFFWAY,Pack of 4 Unisex Eau De Parfums,N/A,N/A,₹840,"₹1,999",(58% off),₹740
RIFFWAY,Pack of 4 Unisex Eau De Parfums,N/A,N/A,₹840,"₹1,999",(58% off),₹740
BOLD CARE,Poseidon Ocean Longest Lasting Eau De Parfum,N/A,N/A,₹503,₹899,(44% off),₹369
The Beard Story,Oasis Eau De Parfum,N/A,N/A,₹974,"₹1,299",(25% off),₹682
India Grooming Club,Royale Rembrandt Perfume,1,2,"₹1,200",N/A,N/A,₹888
RIFFWAY,Pack of 3 Dark Knight Eau de Parfumes,N/A,N/A,₹780,"₹2,999",(74% off),₹721
RIFFWAY,Pack of 3 Europhia Men Perfumes,N/A,N/A,₹780,"₹2,999",(74% off),₹721
DEMI DIEUS,Set of 2 Eau De Parfum,N/A,N/A,₹261,₹899,(71% off),N/A
DEMI DIEUS,Set of 2 Eau De Parfum,N/A,N/A,₹261,₹899,(71% off),N/A
DEMI DIEUS,Set of 2 Men Eau De Parfume,N/A,N/A,₹261,₹899,(71% off),N/A
DEMI DIEUS,Pack of 2 Men Eau De Parfumes,N/A,N/A,₹261,₹899,(71% off),N/A
DEMI DIEUS,Set of 2 Men Eau De Parfume,N/A,N/A,₹261,₹899,(71% off),N/A
DEMI DIEUS,Set of 2 Eau De Parfum,N/A,N/A,₹261,₹899,(71% off),N/A
DEMI DIEUS,Set of 2 Men Eau De Parfume,N/A,N/A,₹261,₹899,(71% off),N/A
DEMI DIEUS,Set of 2 Eau De Parfum,N/A,N/A,₹261,₹899,(71% off),N/A
DEMI DIEUS,Set of 2 Men Eau De Parfume,N/A,N/A,₹261,₹899,(71% off),N/A
RIFFWAY,Men Bold and Mysterious Scent,N/A,N/A,₹540,"₹1,999",(73% off),₹499
RIFFWAY,Men Bold and Mysterious Scent,N/A,N/A,₹780,"₹2,999",(74% off),₹721
RIFFWAY,Pack of 2 Captivating Eau de Parfumes,N/A,N/A,₹540,"₹1,999",(73% off),₹499
RIFFWAY,Men Bold and Mysterious Scent,N/A,N/A,₹780,"₹2,999",(74% off),₹721
RIFFWAY,Pack of 3 Eau De Parfum Travel-Size Mens Perfume 60ml,N/A,N/A,₹780,"₹2,999",(74% off),₹721
RIFFWAY,Men Bold and Mysterious Scent,N/A,N/A,₹540,"₹1,999",(73% off),₹499
RIFFWAY,Pack of 2 Eau De Parfum Paradox 40ml Pocket Perfume for Men,N/A,N/A,₹500,"₹1,999",(75% off),₹462
RIFFWAY,Pack of 3 Eau Da Parfum Dynamo Mens Perfume 60ml,N/A,N/A,₹720,"₹2,999",(76% off),₹666
RIFFWAY,Pack of 3 Eau De Parfum Firefly Fragrance for Men 60ml,N/A,N/A,₹720,"₹2,999",(76% off),₹666
RIFFWAY,Pack of 3 Eau De Parfum Citrus Zest Luxury Mens Fragrance 60ml,N/A,N/A,₹780,"₹2,999",(74% off),₹721
DEMI DIEUS,Set of 2 Men Eau De Parfume,N/A,N/A,₹261,₹899,(71% off),N/A
DEMI DIEUS,Set of 2 Men Eau De Parfume,N/A,N/A,₹261,₹899,(71% off),N/A
