Brand,Product Name,Rating,No. of Ratings,Discounted Price,Original Price,Discount,Offer Price
Mars & Venus,Men Eau De Premium Luxury Perfume - 100 ml,N/A,N/A,"₹2,699","₹2,999",(10% off),"₹2,309"
RIFFWAY,Men Perfume Gift Set Pack of 4,N/A,N/A,₹840,"₹1,999",(58% off),₹740
RIFFWAY,Snowdrop Blossom Eau de Parfum 50ml – Floral and Fresh Aromatic Bliss,N/A,N/A,₹420,₹999,(58% off),₹367
RIFFWAY,Men Spring Long Lasting Perfume,N/A,N/A,₹420,₹999,(58% off),₹367
India Grooming Club,Royale Monarch Perfume,N/A,N/A,"₹1,200",N/A,N/A,₹888
The Beard Story,Absolute Oud Eau De Parfum,N/A,N/A,₹974,"₹1,299",(25% off),₹682
ADEN,Men Oasis Luxury Attar,N/A,N/A,₹645,"₹1,500",(57% off),₹495
RIFFWAY,Confess Perfume - Versatile Unisex Fragrance,N/A,N/A,₹420,₹999,(58% off),₹367
RIFFWAY,Men Sacred Saphire Perfume 50ml,N/A,N/A,₹420,₹999,(58% off),₹367
RIFFWAY,Men Paris Wonder Perfume 50ml,N/A,N/A,₹420,₹999,(58% off),₹367
RIFFWAY,Men Rain Mist Perfume Spray,N/A,N/A,₹420,₹999,(58% off),₹367
RIFFWAY,Unisex Timeless Fragrance,N/A,N/A,₹420,₹999,(58% off),₹367
SENTIRE,"SENTIRE MIRAI 30 ML - Premium Unisex Fragrance, Ultra Long Lasting, Ideal Gift",N/A,N/A,"₹2,799",N/A,N/A,"₹2,435"
FW FAUN WALK,Men Silky Oud Leather Perfume,N/A,N/A,"₹1,424","₹1,499",(5% off),"₹1,229"
FW FAUN WALK,Passion Bomb for Women Similar to Bombshell Perfume,N/A,N/A,"₹2,374","₹2,499",(5% off),"₹2,049"
SENTIRE,Men Casanova Long-Lasting Perfume,N/A,N/A,"₹1,818",N/A,N/A,"₹1,582"
SENTIRE,Men Midnight Long-Lasting Perfume,N/A,N/A,"₹2,799",N/A,N/A,"₹2,435"
FW FAUN WALK,Men Charas Similar to Hawaas Parfum,N/A,N/A,"₹2,374","₹2,499",(5% off),"₹2,049"
SENTIRE,Men Sentire White Oud Perfume,N/A,N/A,"₹2,418",N/A,N/A,"₹2,104"
FW FAUN WALK,Unisex Garnet Smoke Parfume,N/A,N/A,"₹1,424","₹1,499",(5% off),"₹1,229"
SENTIRE,Men Sentire Zephyrine Perfume,N/A,N/A,"₹3,999",N/A,N/A,"₹3,479"
FW FAUN WALK,Men Ocean's Blu Similar to Cool Waterr For Men Perfume,N/A,N/A,"₹2,374","₹2,499",(5% off),"₹2,049"
FW FAUN WALK,Men Celestial Noir Wanted By Night Perfume,N/A,N/A,"₹2,374","₹2,499",(5% off),"₹2,049"
SENTIRE,"SENTIRE MIRAI 30 ML - Premium Unisex Fragrance, Ultra Long Lasting, Ideal Gift",N/A,N/A,"₹2,799",N/A,N/A,"₹2,435"
SENTIRE,Men Midnight Long-Lasting Perfume,N/A,N/A,"₹2,799",N/A,N/A,"₹2,435"
SENTIRE,Men Sentire Sent Aura Perfume,N/A,N/A,₹600,N/A,N/A,₹522
FW FAUN WALK,Men Ocean's Blu Similar to Cool Waterr For Men Perfume,N/A,N/A,"₹2,374","₹2,499",(5% off),"₹2,049"
SENTIRE,Men Sentire Exquisite Perfume,N/A,N/A,"₹1,899",N/A,N/A,"₹1,652"
FW FAUN WALK,Men Silky Oud Leather Perfume,N/A,N/A,"₹1,424","₹1,499",(5% off),"₹1,229"
SENTIRE,Men Sentire White Oud Perfume,N/A,N/A,"₹2,418",N/A,N/A,"₹2,104"
FW FAUN WALK,Unisex Garnet Smoke Parfume,N/A,N/A,"₹1,424","₹1,499",(5% off),"₹1,229"
SENTIRE,Men Casanova Long-Lasting Perfume,N/A,N/A,"₹1,818",N/A,N/A,"₹1,582"
FW FAUN WALK,Men Nomade Rose Perfume,N/A,N/A,"₹2,374","₹2,499",(5% off),"₹2,049"
SENTIRE,Quantillion Long-Lasting Perfume,N/A,N/A,"₹2,799",N/A,N/A,"₹2,435"
SENTIRE,Men Sentire Zephyrine Perfume,N/A,N/A,"₹3,999",N/A,N/A,"₹3,479"
FW FAUN WALK,Passion Bomb for Women Similar to Bombshell Perfume,N/A,N/A,"₹2,374","₹2,499",(5% off),"₹2,049"
SENTIRE,Sentire Calantha Long Lasting Perfume,N/A,N/A,"₹3,999",N/A,N/A,"₹3,479"
ADEN,Men Oasis Luxury Attar,N/A,N/A,₹645,"₹1,500",(57% off),₹495
FASCZO,Confess-A Timeless Men Bold and Magnetic Odour Control Perfume,N/A,N/A,₹200,₹999,(80% off),N/A
RIFFWAY,Men Eau De Perfume,N/A,N/A,₹270,₹999,(73% off),N/A
RIFFWAY,Spiritz Perfume Enchanting and Long-Lasting,N/A,N/A,₹270,₹999,(73% off),N/A
RIFFWAY,The King Eau De Parfum with Aromatic Fragrance,N/A,N/A,₹270,₹999,(73% off),N/A
RIFFWAY,Cube Perume Alluring Unisex Fragrance 20ML,N/A,N/A,₹270,₹999,(73% off),N/A
RIFFWAY,Set of 3 Captivating Musk Eau De Parfums,N/A,N/A,₹780,"₹2,999",(74% off),₹721
RIFFWAY,Cocoblue Eau De Parfum,N/A,N/A,₹270,₹999,(73% off),N/A
RIFFWAY,Dark Knight Perfume Seductive Scent 20ML,N/A,N/A,₹270,₹999,(73% off),N/A
RIFFWAY,Men Perfume Bold and Mysterious Essence 20Ml,N/A,N/A,₹270,₹999,(73% off),N/A
RIFFWAY,Timeless Poison Eau De Parfum,N/A,N/A,₹270,₹999,(73% off),N/A
RIFFWAY,Captivating Musk Eau De Parfum with Citus Fragrance,N/A,N/A,₹270,₹999,(73% off),N/A
RIFFWAY,Chamomile Eau De Parfum with Vanilla Fragrance,N/A,N/A,₹270,₹999,(73% off),N/A
RIFFWAY,Blue Rush Eau De Perfume,N/A,N/A,₹270,₹999,(73% off),N/A
FASCZO,Men Long lasting Premium Pack of 1,N/A,N/A,₹200,₹999,(80% off),N/A
FASCZO,Men Long lasting Premium Pack of 2,N/A,N/A,₹400,"₹1,999",(80% off),₹370
FASCZO,Men Long lasting Premium Pack of 1,N/A,N/A,₹200,₹999,(80% off),N/A
RIFFWAY,Men Bold and Mysterious Scent,N/A,N/A,₹780,"₹2,999",(74% off),₹721
FASCZO,Men Long lasting Premium Pack of 3,N/A,N/A,₹600,"₹2,999",(80% off),₹555
FASCZO,Men Long lasting Premium Pack of 2,N/A,N/A,₹400,"₹1,999",(80% off),₹370
FASCZO,Men Long lasting Premium Pack of 3,N/A,N/A,₹600,"₹2,999",(80% off),₹555
RIFFWAY,Men Angel Perfume Long-Lasting Natural Fragrance,N/A,N/A,₹220,₹999,(78% off),N/A
Mars & Venus,Men Eau De Premium Luxury Perfume - 100 ml,N/A,N/A,"₹2,699","₹2,999",(10% off),"₹2,309"
Mars & Venus,Men Eau De Premium Luxury Perfume - 100 ml,N/A,N/A,"₹2,699","₹2,999",(10% off),"₹2,309"
RIFFWAY,Men Angel Trillium Long-Lasting Perfume,N/A,N/A,₹220,₹999,(78% off),N/A
RIFFWAY,Angel Chamomile Long-Lasting Perfume,N/A,N/A,₹220,₹999,(78% off),N/A
RIFFWAY,Men Beauty Perfume Fruity Frrgrance 20ML,N/A,N/A,₹270,₹999,(73% off),N/A
RIFFWAY,Mr. Right Perfume The Ultimate Power Fragrance 20ML,N/A,N/A,₹270,₹999,(73% off),N/A
OMBRE BLISS,Men Honour Long-Lasting Perfume 100 ml,N/A,N/A,"₹1,079","₹1,199",(10% off),₹923
RIFFWAY,Dark Rebel Eau de Toilette Perfume,N/A,N/A,₹270,₹999,(73% off),N/A
DEMI DIEUS,Set of 2 Men Eau De Parfume,N/A,N/A,₹261,₹899,(71% off),N/A
RIFFWAY,Platinum Perfume Mysterious Unisex Perfume 20ML,N/A,N/A,₹270,₹999,(73% off),N/A
RIFFWAY,Trillium Perfume Warm and Inviting Unisex Scent 20ML,N/A,N/A,₹270,₹999,(73% off),N/A
RIFFWAY,Men Eau de Perfume Pack Of 3,N/A,N/A,₹780,"₹2,999",(74% off),₹721
FASCZO,Men Long lasting Premium Pack of 1,N/A,N/A,₹200,₹999,(80% off),N/A
FASCZO,Men Long lasting Premium Pack of 2,N/A,N/A,₹400,"₹1,999",(80% off),₹370
FASCZO,Dark Knight Men Perfume - Refreshing Woody & Spicy Scent 20ml,N/A,N/A,₹400,"₹1,999",(80% off),₹370
RIFFWAY,Eau De Parfum Capivating Musk Premium 20ml for Men,N/A,N/A,₹250,₹999,(75% off),N/A
RIFFWAY,Dewy Perfume with Citrus Fragrance,N/A,N/A,₹270,₹999,(73% off),N/A
FASCZO,Men Fire Fly Perfume Pack Of 3,N/A,N/A,₹600,"₹2,999",(80% off),₹555
FASCZO,Men Long lasting Premium Pack of 2,N/A,N/A,₹400,"₹1,999",(80% off),₹370
FASCZO,Men Long lasting Premium Pack of 3,N/A,N/A,₹600,"₹2,999",(80% off),₹555
FASCZO,Men Long lasting Premium Pack of 3,N/A,N/A,₹600,"₹2,999",(80% off),₹555
FASCZO,Men Long lasting Premium Pack of 3,N/A,N/A,₹600,"₹2,999",(80% off),₹555
RIFFWAY,Men Eau De Parfum Lucky Star Perfume 20ml,N/A,N/A,₹250,₹999,(75% off),N/A
FASCZO,Men Long lasting Premium Pack of 3,N/A,N/A,₹600,"₹2,999",(80% off),₹555
FASCZO,Men Bold and Masculine Fragrance,N/A,N/A,₹400,"₹1,999",(80% off),₹370
FASCZO,Men Bold and Masculine Fragrance,N/A,N/A,₹600,"₹2,999",(80% off),₹555
FASCZO,Men Long lasting Premium Pack of 3,N/A,N/A,₹600,"₹2,999",(80% off),₹555
FASCZO,Men Long lasting Premium Pack of 3,N/A,N/A,₹600,"₹2,999",(80% off),₹555
RIFFWAY,Europhia Perfume with Cool & Metallic Fragrance,N/A,N/A,₹270,₹999,(73% off),N/A
RIFFWAY,Timeless Poison Perfume Cool and Refreshing Sensation 20ML,N/A,N/A,₹270,₹999,(73% off),N/A
FASCZO,Men Long lasting Premium Pack of 2,N/A,N/A,₹400,"₹1,999",(80% off),₹370
FASCZO,Pack of 2 Men Long lasting Premium,N/A,N/A,₹400,"₹1,999",(80% off),₹370
FASCZO,Men Long lasting Premium Pack of 3,N/A,N/A,₹600,"₹2,999",(80% off),₹555
RIFFWAY,Eau De Parfum 20ml Cocoblue Mens Perfume,N/A,N/A,₹270,₹999,(73% off),N/A
RIFFWAY,Men Eau De Parfum Dewy High-Performance Perfume 20ml,N/A,N/A,₹250,₹999,(75% off),N/A
RIFFWAY,Eau De Parfum Firefly Fragrance for Men 20ml,N/A,N/A,₹250,₹999,(75% off),N/A
RIFFWAY,Eau De Parfum Splash Mens 20ml Fragrance,N/A,N/A,₹250,₹999,(75% off),N/A
FASCZO,Men Bold and Masculine Fragrance,N/A,N/A,₹600,"₹2,999",(80% off),₹555
FASCZO,Men Long lasting Premium Pack of 2,N/A,N/A,₹400,"₹1,999",(80% off),₹370
RIFFWAY,Men Eau De Parfum Dark Rebel Spray 20ml Fresh & Bold Long-Lasting Fragrance,N/A,N/A,₹250,₹999,(75% off),N/A
FASCZO,Men Long lasting Premium,N/A,N/A,₹200,₹999,(80% off),N/A
FASCZO,Men Long lasting Premium Pack of 2,N/A,N/A,₹400,"₹1,999",(80% off),₹370
RIFFWAY,Eau De Parfum 20ml Cabret Mens Perfume,N/A,N/A,₹250,₹999,(75% off),N/A
RIFFWAY,Eau De Parfum Escada Sports Mens Fragrance 20ml,N/A,N/A,₹250,₹999,(75% off),N/A
RIFFWAY,Eau De Parfum Travel-Size Mens Perfume 20ml,N/A,N/A,₹270,₹999,(73% off),N/A
DEMI DIEUS,Pack of 2 Men Eau De Parfume,N/A,N/A,₹261,₹899,(71% off),N/A
DEMI DIEUS,Set of 4 Men Eau De Parfume Gift Set,N/A,N/A,₹345,"₹1,499",(77% off),₹319
RIFFWAY,Unisex Eternal Desire Perfume,N/A,N/A,₹270,₹999,(73% off),N/A
RIFFWAY,Unisex Confess Mystique Long-Lasting Perfume,N/A,N/A,₹270,₹999,(73% off),N/A
RIFFWAY,Touch Perfume Unisex Scent,N/A,N/A,₹270,₹999,(73% off),N/A
Mars & Venus,Men Long-Lasting Perfume 100ml,N/A,N/A,"₹2,699","₹2,999",(10% off),"₹2,309"
Mars & Venus,Men Long-Lasting Perfume 100ml,N/A,N/A,"₹2,699","₹2,999",(10% off),"₹2,309"
RIFFWAY,Unisex Pleasure Perfume  Premium 50ml Fragrance for All,N/A,N/A,₹420,₹999,(58% off),₹367
RIFFWAY,Men Angel Perfume Long-Lasting Natural Fragrance,N/A,N/A,₹220,₹999,(78% off),N/A
RIFFWAY,Modern Unisex Perfume with Lasting Power,N/A,N/A,₹420,₹999,(58% off),₹367
RIFFWAY,Cube Eau de Parfum,N/A,N/A,₹420,₹999,(58% off),₹367
RIFFWAY,Men  Sweet Cherry Perfume,N/A,N/A,₹220,₹999,(78% off),N/A
Mars & Venus,Men Eau De Premium Luxury Perfume - 100 ml,N/A,N/A,"₹2,699","₹2,999",(10% off),"₹2,309"
RIFFWAY,Timeliness Eau de Parfum,N/A,N/A,₹220,₹999,(78% off),N/A
RIFFWAY,Platinum Luxury Perfume for Unisex,N/A,N/A,₹220,₹999,(78% off),N/A
RIFFWAY,Men Strawberry Fizz 50ml Perfume,N/A,N/A,₹420,₹999,(58% off),₹367
RIFFWAY,Men  Orchid Bloom Luxe Perfume,N/A,N/A,₹220,₹999,(78% off),N/A
RIFFWAY,Fairy Floss Luxe Perfume,N/A,N/A,₹220,₹999,(78% off),N/A
RIFFWAY,Involve Essence 20ml Perfume,N/A,N/A,₹270,₹999,(73% off),N/A
RIFFWAY,Platinum Eau De Perfume,N/A,N/A,₹270,₹999,(73% off),N/A
RIFFWAY,Bloom Bliss Perfume,N/A,N/A,₹270,₹999,(73% off),N/A
India Grooming Club,Royale Gallant Perfume,N/A,N/A,"₹1,200",N/A,N/A,₹900
RIFFWAY,Men Angel Sense of Smell Long-Lasting Perfume,N/A,N/A,₹220,₹999,(78% off),N/A
RIFFWAY,Men Happiness Fragrance - 50 ml,N/A,N/A,₹420,₹999,(58% off),₹367
RIFFWAY,Fire Fly Signature Perfume,N/A,N/A,₹220,₹999,(78% off),N/A
RIFFWAY,Sweet Cherry Eau de Parfum,N/A,N/A,₹220,₹999,(78% off),N/A
RIFFWAY,Chamomile Perfume  Long-Lasting Natural Fragrance,N/A,N/A,₹220,₹999,(78% off),N/A
RIFFWAY,Rosy Peral Bliss Eau de Parfum,N/A,N/A,₹220,₹999,(78% off),N/A
RIFFWAY,Amethys Perfume Premium 50ml Fragrance,N/A,N/A,₹420,₹999,(58% off),₹367
RIFFWAY,Men Eau De Parfum,N/A,N/A,₹220,₹999,(78% off),N/A
RIFFWAY,Redefining Fresh and Floral,N/A,N/A,₹220,₹999,(78% off),N/A
RIFFWAY,Men Confess Perfume,N/A,N/A,₹220,₹999,(78% off),N/A
RIFFWAY,Touch Perfume  Fresh and Feminine Floral Blend,N/A,N/A,₹220,₹999,(78% off),N/A
RIFFWAY,The Scent of Fresh Rain in a Bottle,N/A,N/A,₹220,₹999,(78% off),N/A
RIFFWAY,Men Blue Sky Rose 50ml Fragrance,N/A,N/A,₹420,₹999,(58% off),₹367
Mars & Venus,Men Eau De Premium Luxury Perfume - 100 ml,N/A,N/A,"₹2,699","₹2,999",(10% off),"₹2,309"
RIFFWAY,Spritz Premium Perfume Spray,N/A,N/A,₹220,₹999,(78% off),N/A
RIFFWAY,Men Amethyst Perfume,N/A,N/A,₹220,₹999,(78% off),N/A
RIFFWAY,Men Cube Bloom Perfume,N/A,N/A,₹220,₹999,(78% off),N/A
RIFFWAY,Men Sunny Side Rose 50ml Perfume,N/A,N/A,₹420,₹999,(58% off),₹367
FW FAUN WALK,Bulgarian oud Pocket Perfume,N/A,N/A,₹664,₹699,(5% off),₹573
SENTIRE,Sentire Deep Crush Perfume,N/A,N/A,"₹1,799",N/A,N/A,"₹1,565"
SENTIRE,Men Sentire Woody Perfume,N/A,N/A,₹600,N/A,N/A,₹522
SENTIRE,Men Sentire Woody Perfume,N/A,N/A,₹600,N/A,N/A,₹522
FW FAUN WALK,Men Ambery Smoke Long-Lasting Perfume,N/A,N/A,"₹2,374","₹2,499",(5% off),"₹2,049"
Armaf,Ventana Eau De Parfum,N/A,N/A,"₹2,490",N/A,N/A,"₹1,992"
The Man Company,Privilege Active with Legend & Intense Body Spray Set,4,8,₹475,₹897,(47% off),₹404
RIFFWAY,Pack of 3 Intense Woody & Spicy Fragrance Eau De Parfum Mens 60ml,N/A,N/A,₹720,"₹2,999",(76% off),₹666
RIFFWAY,Pack of 2 The King Eau De Parfum with Premium Masculine Notes 40 ml,N/A,N/A,₹540,"₹1,999",(73% off),₹499
RIFFWAY,Pack of 3 Blue Rush Eau De Parfum for Men 60ml,N/A,N/A,₹780,"₹2,999",(74% off),₹721
RIFFWAY,Pack of 3 Captivating Musk Premium 60ml Eau de Parfum for Men,N/A,N/A,₹720,"₹2,999",(76% off),₹666
RIFFWAY,Pack of 3 Eau De Parfum Lucky Star Mens Perfume 60ml,N/A,N/A,₹720,"₹2,999",(76% off),₹666
RIFFWAY,Men Premium Eau de Perfume,N/A,N/A,₹500,"₹1,999",(75% off),₹462
RIFFWAY,Men All-Day Wear Eau De Perfume,N/A,N/A,₹250,₹999,(75% off),N/A
RIFFWAY,Pack of 2 Eau De Parfum Timeless Poision 40ml Intense Fragrance for Men,N/A,N/A,₹500,"₹1,999",(75% off),₹462
RIFFWAY,Pack of 2 Men Splash 40ml Perfume,N/A,N/A,₹500,"₹1,999",(75% off),₹462
FW FAUN WALK,Men Long lasting Premium Pheromone Perfume,N/A,N/A,"₹1,350","₹1,500",(10% off),"₹1,155"
RIFFWAY,Men Eau de Perfume Pack Of 3,N/A,N/A,₹780,"₹2,999",(74% off),₹721
RIFFWAY,Men Eau de Perfume Pack Of 3,N/A,N/A,₹780,"₹2,999",(74% off),₹721
RIFFWAY,Paradox Men Perfume - Elegant and Magnetic Scent 40ml,N/A,N/A,₹540,"₹1,999",(73% off),₹499
RIFFWAY,Men Bold and Mysterious Scent,N/A,N/A,₹780,"₹2,999",(74% off),₹721
RIFFWAY,Spiritz Men Perfume - Bold and Energetic Aroma 60ml,N/A,N/A,₹780,"₹2,999",(74% off),₹721
RIFFWAY,Men Bold and Mysterious Scent,N/A,N/A,₹540,"₹1,999",(73% off),₹499
RIFFWAY,Men Bold and Mysterious Scent,N/A,N/A,₹540,"₹1,999",(73% off),₹499
RIFFWAY,Men Bold and Mysterious Scent,N/A,N/A,₹540,"₹1,999",(73% off),₹499
SENTIRE,Men Sentire Casanova Perfume,N/A,N/A,₹700,N/A,N/A,₹609
SENTIRE,Men Sentire Le Chocolat Perfume,N/A,N/A,₹600,N/A,N/A,₹522
SENTIRE,Men Sentire Seductive Perfume,N/A,N/A,₹600,N/A,N/A,₹522
RIFFWAY,Men Perfume Set 4,N/A,N/A,₹840,"₹1,999",(58% off),₹740
RIFFWAY,Men Perfume Set 4 Bottles,N/A,N/A,₹840,"₹1,999",(58% off),₹740
RIFFWAY,Men Perfume Set of 4,N/A,N/A,₹840,"₹1,999",(58% off),₹740
RIFFWAY,Bright Sunshine Scent - Unisex 50ml Long-Lasting Perfume,N/A,N/A,₹420,₹999,(58% off),₹367
RIFFWAY,Pack of 4 Unisex Eau De Parfums,N/A,N/A,₹840,"₹1,999",(58% off),₹740
RIFFWAY,Pack of 4 Unisex Eau De Parfums,N/A,N/A,₹840,"₹1,999",(58% off),₹740
RIFFWAY,Pack of 4 Unisex Eau De Parfums,N/A,N/A,₹840,"₹1,999",(58% off),₹740
RIFFWAY,Pack of 4 Unisex Eau De Parfums,N/A,N/A,₹840,"₹1,999",(58% off),₹740
VISAKHA DAIRY,BEAST - X King Luxury Exotic Perfume for Men,N/A,N/A,₹499,N/A,N/A,₹394
St.john,Cobra Live Sports & Cool Deodorant Body Spray,N/A,N/A,₹736,₹897,(18% off),₹515
St.john,ST.JOHN Sports Limited Edition Deodorant Spray & Cobra Eau De Parfum,N/A,N/A,₹603,₹718,(16% off),₹422
MARYAJ,Grey Stone Eau de Parfum for Him - 100 ml,3.7,12,₹751,"₹1,669",(55% off),₹584
St.john,Cobra Cool Limited Edition Deodorant Spray,N/A,N/A,₹897,N/A,N/A,₹655
Archies Parfum,Ghost Parfum Black Original & Ghost Deo Original,4.5,2,₹749,N/A,N/A,₹524
Fragrance & Beyond,Aromatherapy Lavender Sleep Serenity Soy Candle,N/A,N/A,"₹1,790",N/A,N/A,"₹1,253"
St.john,Cobra Deodorant Men Live & Sports Limited Edition Deodorant Spray,N/A,N/A,₹596,₹718,(17% off),₹417
RIFFWAY,Men Bold and Mysterious Scent,N/A,N/A,₹780,"₹2,999",(74% off),₹721
RIFFWAY,Pack of 3 Citrus Twist Perfumes,N/A,N/A,₹780,"₹2,999",(74% off),₹721
RIFFWAY,Pack of 3 Dewy Perfumes Sophisticated & Elegant,N/A,N/A,₹780,"₹2,999",(74% off),₹721
DEMI DIEUS,Set of 2 Men Eau De Perfume,N/A,N/A,₹261,₹899,(71% off),N/A
DEMI DIEUS,Pack of 2 Men Eau De Parfume,N/A,N/A,₹261,₹899,(71% off),N/A
DEMI DIEUS,Set of 2 Eau De Parfum,N/A,N/A,₹261,₹899,(71% off),N/A
DEMI DIEUS,Set of 2 Men Eau De Parfume,N/A,N/A,₹261,₹899,(71% off),N/A
DEMI DIEUS,Set of 2 Eau De Parfum,N/A,N/A,₹261,₹899,(71% off),N/A
DEMI DIEUS,Set of 2 Eau De Parfum,N/A,N/A,₹261,₹899,(71% off),N/A
FW FAUN WALK,Men Long lasting Premium Pheromone Perfume,N/A,N/A,"₹1,350","₹1,500",(10% off),"₹1,155"
RIFFWAY,Pack of 3 Firefly Men's Perfume 60ml,N/A,N/A,₹780,"₹2,999",(74% off),₹721
RIFFWAY,Pack of 4 Unisex Eau De Parfums,N/A,N/A,₹840,"₹1,999",(58% off),₹740
RIFFWAY,Pack of 4 Unisex Eau De Parfums,N/A,N/A,₹840,"₹1,999",(58% off),₹740
RIFFWAY,Pack of 4 Unisex Eau De Parfums,N/A,N/A,₹840,"₹1,999",(58% off),₹740
RIFFWAY,Pack of 4 Unisex Eau De Parfums,N/A,N/A,₹840,"₹1,999",(58% off),₹740
RIFFWAY,Pack of 4 Unisex Eau De Parfums,N/A,N/A,₹840,"₹1,999",(58% off),₹740
RIFFWAY,Pack of 4 Unisex Eau De Parfums,N/A,N/A,₹840,"₹1,999",(58% off),₹740
RIFFWAY,Pack of 4 Unisex Eau De Parfums,N/A,N/A,₹840,"₹1,999",(58% off),₹740
DEMI DIEUS,Pack of 2 Men Eau De Parfume,N/A,N/A,₹261,₹899,(71% off),N/A
DEMI DIEUS,Set of 2 Women Eau De Parfume,N/A,N/A,₹261,₹899,(71% off),N/A
DEMI DIEUS,Set of 2 Men Eau De Parfume,N/A,N/A,₹261,₹899,(71% off),N/A
DEMI DIEUS,Set of 2 Women Eau De Parfume,N/A,N/A,₹261,₹899,(71% off),N/A
DEMI DIEUS,Set of 2 Men Eau De Parfume,N/A,N/A,₹261,₹899,(71% off),N/A
DEMI DIEUS,Set of 2 Eau De Parfum,N/A,N/A,₹261,₹899,(71% off),N/A
RIFFWAY,Pack of 4 Unisex Eau De Parfums,N/A,N/A,₹840,"₹1,999",(58% off),₹740
RIFFWAY,Men Bold and Mysterious Scent,N/A,N/A,₹540,"₹1,999",(73% off),₹499
RIFFWAY,Pack of 2 Eau De Parfum Lucky Star Mens Perfume 40ml,N/A,N/A,₹540,"₹1,999",(73% off),₹499
RIFFWAY,Blazer Men Premium Eau de Parfum Travel-Friendly Size 20ml,N/A,N/A,₹270,₹999,(73% off),N/A
RIFFWAY,Pack of 3 Eau DeParfum Timeless Poision 60ml Intense Fragrance for Men,N/A,N/A,₹720,"₹2,999",(76% off),₹666
RIFFWAY,Men Bold and Mysterious Scent,N/A,N/A,₹540,"₹1,999",(73% off),₹499
RIFFWAY,Men Bold and Mysterious Scent,N/A,N/A,₹780,"₹2,999",(74% off),₹721
RIFFWAY,Men Bold and Mysterious Scent,N/A,N/A,₹540,"₹1,999",(73% off),₹499
RIFFWAY,Men Bold and Mysterious Scent,N/A,N/A,₹540,"₹1,999",(73% off),₹499
RIFFWAY,Firefly Men's Perfume-Intense and Captivating Scent 40ml,N/A,N/A,₹540,"₹1,999",(73% off),₹499
RIFFWAY,Pack of 2 Blue Rush Eau De Parfum for Men 40ml,N/A,N/A,₹540,"₹1,999",(73% off),₹499
RIFFWAY,Pack of 2 Eau De Parfum 40ml Cabret Mens Perfume,N/A,N/A,₹540,"₹1,999",(73% off),₹499
RIFFWAY,Men Bold and Mysterious Scent,N/A,N/A,₹780,"₹2,999",(74% off),₹721
RIFFWAY,Pack of 2 Eau De Parfum Spiritz Mens Fragrance 40ml,N/A,N/A,₹500,"₹1,999",(75% off),₹462
RIFFWAY,Men Bold and Mysterious Scent,N/A,N/A,₹780,"₹2,999",(74% off),₹721
RIFFWAY,Men Bold and Mysterious Scent,N/A,N/A,₹540,"₹1,999",(73% off),₹499
FW FAUN WALK,Long lasting Premium Pheromone Perfume,N/A,N/A,"₹1,350","₹1,500",(10% off),"₹1,155"
RIFFWAY,Men Bold and Mysterious Scent,N/A,N/A,₹540,"₹1,999",(73% off),₹499
RIFFWAY,Pack of 2 Spiritz Men's Perfumes Aroma 40ml,N/A,N/A,₹540,"₹1,999",(73% off),₹499
RIFFWAY,Men Bold and Mysterious Scent,N/A,N/A,₹540,"₹1,999",(73% off),₹499
RIFFWAY,Men Bold and Mysterious Scent,N/A,N/A,₹540,"₹1,999",(73% off),₹499
RIFFWAY,Men Bold and Mysterious Scent,N/A,N/A,₹540,"₹1,999",(73% off),₹499
RIFFWAY,Pack of 2 Eau De Parfum Citrus Zest Luxury Mens Fragrance 40ml,N/A,N/A,₹540,"₹1,999",(73% off),₹499
RIFFWAY,Eau De Parfum Chamomile Men Perfume Spray 20ml,N/A,N/A,₹270,₹999,(73% off),N/A
RIFFWAY,Pocket Perfume for Men,N/A,N/A,₹720,"₹2,999",(76% off),₹666
RIFFWAY,Men Luxury Long-Lasting Perfume,N/A,N/A,₹250,₹999,(75% off),N/A
RIFFWAY,Pack of 3 Men Eau De Parfum Dark Rebel Spray 60ml,N/A,N/A,₹780,"₹2,999",(74% off),₹721
RIFFWAY,Perfume Spray for Men,N/A,N/A,₹720,"₹2,999",(76% off),₹666
RIFFWAY,Men Eau De Perfume,N/A,N/A,₹250,₹999,(75% off),N/A
RIFFWAY,Men Luxury Long-Lasting Perfume,N/A,N/A,₹720,"₹2,999",(76% off),₹666
RIFFWAY,Men Eau De Parfum Intense Woody & Spicy Fragrance 40ml,N/A,N/A,₹500,"₹1,999",(75% off),₹462
RIFFWAY,Pack of 3 The King Eau de Parfum with Premium Masculine Notes 60 ml,N/A,N/A,₹720,"₹2,999",(76% off),₹666
RIFFWAY,Pack of 3 Eau De Parfum Escada Sports Mens Fragrance 60ml,N/A,N/A,₹780,"₹2,999",(74% off),₹721
RIFFWAY,Pack of 3 Blazer Men Premium Eau de Parfum Travel-Friendly Size 60ml,N/A,N/A,₹720,"₹2,999",(76% off),₹666
RIFFWAY,Pack of 2 Eau De Parfum Dynamo Mens Perfume 40ml,N/A,N/A,₹540,"₹1,999",(73% off),₹499
RIFFWAY,Pack of 2 Eau De Parfum Firefly Fragrance for Men 40ml,N/A,N/A,₹540,"₹1,999",(73% off),₹499
RIFFWAY,Pack of 2 Men Eau De Parfum Dark Rebel Spray 40ml,N/A,N/A,₹500,"₹1,999",(75% off),₹462
RIFFWAY,Pack of 2 Intense Eau De Parfum Dark Monent for Men 40ml,N/A,N/A,₹500,"₹1,999",(75% off),₹462
RIFFWAY,Men Bold and Mysterious Scent,N/A,N/A,₹540,"₹1,999",(73% off),₹499
RIFFWAY,Pack of 2 Eau De Parfum Travel-Size Mens Perfume 40ml,N/A,N/A,₹540,"₹1,999",(73% off),₹499
RIFFWAY,Pack of 2 Aqua Men Luxury Long-Lasting Mens Perfume 40ml,N/A,N/A,₹540,"₹1,999",(73% off),₹499
RIFFWAY,Pack of 2 Men Eau De Parfum 40ml Europhia Spray,N/A,N/A,₹500,"₹1,999",(75% off),₹462
RIFFWAY,Men Bold and Mysterious Scent,N/A,N/A,₹780,"₹2,999",(74% off),₹721
RIFFWAY,Citrus Twist Perfume for Men - Musky & Alluring Aroma 40ml,N/A,N/A,₹540,"₹1,999",(73% off),₹499
RIFFWAY,Eau De Parfum Citrus Zest Luxury Mens Fragrance 20ml,N/A,N/A,₹270,₹999,(73% off),N/A
RIFFWAY,Pack of 2 Eau De Parfum Chamomile Mens Perfume Spray 20ml,N/A,N/A,₹500,"₹1,999",(75% off),₹462
RIFFWAY,Pack of 2 Eau De Parfum Escada Sports Mens Fragrance 40ml,N/A,N/A,₹540,"₹1,999",(73% off),₹499
RIFFWAY,Pack of 3 Men Dewy High Performance Eau De Parfum 60ml,N/A,N/A,₹720,"₹2,999",(76% off),₹666
RIFFWAY,Men High-Quality Eau De Perfume,N/A,N/A,₹720,"₹2,999",(76% off),₹666
RIFFWAY,Pack of 3 Eau De Parfum 60ml Cocoblue Mens Perfume,N/A,N/A,₹780,"₹2,999",(74% off),₹721
RIFFWAY,Men Woody & Spicy Fragrance,N/A,N/A,₹250,₹999,(75% off),N/A
RIFFWAY,Set of 4 Unisex Eau De Parfums-80 ml,N/A,N/A,₹740,"₹1,999",(63% off),₹647
RIFFWAY,Pack of 4 Unisex Eau De Parfums,N/A,N/A,₹840,"₹1,999",(58% off),₹740
RIFFWAY,Pack of 4 Unisex Eau De Parfums,N/A,N/A,₹840,"₹1,999",(58% off),₹740
RIFFWAY,Pack of 4 Unisex Eau De Parfums,N/A,N/A,₹840,"₹1,999",(58% off),₹740
RIFFWAY,Pack of 4 Unisex Eau De Parfums,N/A,N/A,₹840,"₹1,999",(58% off),₹740
DEMI DIEUS,Set of 2 Women Eau De Parfume,N/A,N/A,₹261,₹899,(71% off),N/A
DEMI DIEUS,Pack of 2 Men Eau De Parfume,N/A,N/A,₹261,₹899,(71% off),N/A
DEMI DIEUS,Set of 2 Men Eau De Parfume,N/A,N/A,₹261,₹899,(71% off),N/A
DEMI DIEUS,Set of 2 Eau De Parfum,N/A,N/A,₹261,₹899,(71% off),N/A
DEMI DIEUS,Set of 2 Women Eau De Perfume,N/A,N/A,₹261,₹899,(71% off),N/A
DEMI DIEUS,Set of 2 Eau De Parfum Fire,N/A,N/A,₹261,₹899,(71% off),N/A
DEMI DIEUS,Set of 2 Men Eau De Parfume,N/A,N/A,₹261,₹899,(71% off),N/A
DEMI DIEUS,Pack of 2 Men Eau De Parfume,N/A,N/A,₹261,₹899,(71% off),N/A
DEMI DIEUS,Set of 2 Men Eau De Parfume,N/A,N/A,₹261,₹899,(71% off),N/A
DEMI DIEUS,Pack of 2 Men Eau De Parfume,N/A,N/A,₹261,₹899,(71% off),N/A
DEMI DIEUS,Set of 2 Women Eau De Parfume,N/A,N/A,₹261,₹899,(71% off),N/A
DEMI DIEUS,Set of 2 Men Eau De Parfume,N/A,N/A,₹261,₹899,(71% off),N/A
DEMI DIEUS,Set of 2 Eau De Parfum,N/A,N/A,₹261,₹899,(71% off),N/A
DEMI DIEUS,Set of 2 Men Eau De Parfume,N/A,N/A,₹261,₹899,(71% off),N/A
DEMI DIEUS,Set of 2 Women Eau De Parfume,N/A,N/A,₹261,₹899,(71% off),N/A
RIFFWAY,Flowering Meadow Signature Scent - Exquisite 50ml Perfume,N/A,N/A,₹420,₹999,(58% off),₹367
RIFFWAY,"Cherish Eau de Parfum - Gender-Neutral Luxury Fragrance, 50ml",N/A,N/A,₹420,₹999,(58% off),₹367
RIFFWAY,Deep Reflection Unisex 50ml Perfume - Perfect Blend of Elegance & Charm,N/A,N/A,₹420,₹999,(58% off),₹367
RIFFWAY,Inlove Eau de Parfum 50ml,N/A,N/A,₹420,₹999,(58% off),₹367
RIFFWAY,Trillium Essence Amethyst Perfume – 50ml Gender-Neutral Elegance,N/A,N/A,₹420,₹999,(58% off),₹367
RIFFWAY,Essence Of Beauty 50ml Perfume,N/A,N/A,₹420,₹999,(58% off),₹367
RIFFWAY,Men Platinum Perfume 50 ml,N/A,N/A,₹420,₹999,(58% off),₹367
RIFFWAY,Men Perfume Set Perfect Gift,N/A,N/A,₹840,"₹1,999",(58% off),₹740
RIFFWAY,Men Perfume Set of 4,N/A,N/A,₹840,"₹1,999",(58% off),₹740
RIFFWAY,Men Perfume Set of 4,N/A,N/A,₹840,"₹1,999",(58% off),₹740
RIFFWAY,Premium Fragrance Set for Men,N/A,N/A,₹840,"₹1,999",(58% off),₹740
RIFFWAY,Men Fragrance Set 4 Bottles,N/A,N/A,₹840,"₹1,999",(58% off),₹740
RIFFWAY,Men Perfume Set 4 Fragrances,N/A,N/A,₹840,"₹1,999",(58% off),₹740
RIFFWAY,Men Perfume Gift Set 4,N/A,N/A,₹840,"₹1,999",(58% off),₹740
RIFFWAY,Citrus Twist Eau de Parfum – 50ml: Alluring Scent with Long-Lasting Notes,N/A,N/A,₹420,₹999,(58% off),₹367
RIFFWAY,Men Spring Long Lasting Perfume,N/A,N/A,₹420,₹999,(58% off),₹367
