Brand,Product Name,Rating,No. of Ratings,Discounted Price,Original Price,Discount,Offer Price
AJMAL,Silver Shade EDP 100 ml,4,200,"₹1,200","₹2,000",(40% off),₹880
AZZARO,The Most Wanted Eau De Parfum Intense Spray,4.3,84,"₹9,200",N/A,N/A,"₹7,200"
CALVIN KLEIN,One Eau De Toilette,3.9,102,"₹3,868","₹5,950",(35% off),"₹3,768"
VALENTINO,Born In Roma Uomo Coral Eau De Toilette,4.1,29,"₹8,500",N/A,N/A,"₹6,500"
VILLAIN,Eau De Parfum Premium Long Lasting Fragrance Spray - Woody & Spicy,N/A,N/A,₹360,₹799,(55% off),₹296
SCOTCH & SODA,Barfly Eau De Toilette - 100 ml,4.1,19,"₹5,999",N/A,N/A,"₹4,679"
AJMAL,Kuro Eau De Parfum,3.9,100,"₹2,400","₹3,000",(20% off),"₹1,740"
WILD STONE,Wild Stone Edge Eau De Parfum,4.2,386,₹350,₹699,(50% off),₹266
SCOTCH & SODA,Barfly Eau De Toilette,4,23,"₹3,999",N/A,N/A,"₹2,799"
CALVIN KLEIN,Defy Eau De Parfum,4.2,12,"₹5,753","₹8,850",(35% off),"₹5,653"
WILD STONE,Code Platinum Deodorant Body Perfume,3.8,35,₹193,₹275,(30% off),₹169
VALENTINO,Born In Roma Uomo Eau De Toilette,4.2,9,"₹6,400",N/A,N/A,"₹4,736"
Beardo,Origin Eau De Parfum,3.9,708,₹324,"₹1,200",(73% off),₹300
VILLAIN,Luxury Party Combo Pack of 2 Premium Long Lasting Perfume for Men,N/A,N/A,₹639,"₹1,598",(60% off),₹527
Beardo,Whisky Smoke Bourbon & Mariner Eau De Parfum Combo,4.1,126,₹500,"₹1,998",(75% off),₹462
WILD STONE,Hydra Energy Eau De Parfum,4.2,224,₹325,₹649,(50% off),₹247
JAGUAR,Classic Black Eau de Toilette,3.9,260,"₹2,665","₹4,100",(35% off),"₹2,091"
SNITCH,Snitch Tonka Al Arabia Perfume,4,7,₹824,"₹1,499",(45% off),₹724
TOMMY HILFIGER,Eau de Toilette -100 ml,4.6,9,"₹3,480","₹5,800",(40% off),"₹2,726"
WILD STONE,Hydra Energy Eau De Parfum,4,189,₹279,₹399,(30% off),₹227
AJMAL,Evoke Gold Edition Him Eau De Parfum- 90 ml,3.9,67,"₹2,925","₹4,500",(35% off),"₹2,115"
AJMAL,Yearn Aquatic Perfume Eau De Parfum Long Lasting Scent Spray Party Wear Gift for Men,3.8,54,₹450,"₹1,000",(55% off),₹370
RALPH LAUREN,Polo 67 Eau De Toilette for Men,N/A,N/A,"₹7,800",N/A,N/A,"₹5,800"
AJMAL,Zeal EDP 100 ml,4,96,"₹1,600","₹2,000",(20% off),"₹1,160"
Beardo,Eau De Parfum for Men Trial Kit,3.2,48,₹384,₹699,(45% off),₹336
Embark,Men My Time for Him Aromatic & Chypre Luxury Eau De Parfum,4.7,3,"₹1,402","₹1,895",(26% off),"₹1,080"
DAVIDOFF,Eau De Toilette Spray,4,48,"₹5,900",N/A,N/A,"₹4,543"
PRADA,Luna Rossa Carbon Eau De Toilette,4.6,16,"₹8,600",N/A,N/A,"₹6,600"
AJMAL,Artisan Luxury Perfume Gift for Men & Women,N/A,N/A,₹599,₹999,(40% off),₹509
Beardo,Whisky Smoke & Mafia Eau De Parfum Combo,4.2,68,₹524,"₹1,498",(65% off),₹458
Beardo,Men Godfather & Whisky Smoke Body Spray Set,4.1,20,₹216,₹698,(69% off),₹203
CALVIN KLEIN,Be Eau De Toilette,3.3,22,"₹3,868","₹5,950",(35% off),"₹3,768"
Bella Vita Organic,Luxury B.L.U Eau De Parfum,4.1,35,₹901,"₹1,099",(18% off),₹631
WILD STONE,Pack of 4 Edge Forest Spice Hydra Energy & Ultra Sensual Perfume Gift Set for Men,4.4,12,₹549,₹999,(45% off),₹440
Beardo,Don Perfume Eau De Parfum for Men,4.4,46,₹300,₹999,(70% off),₹277
AJMAL,ASCEND Fougere Long Lasting Eau De Parfum Gift for Men,4.1,16,₹450,"₹1,000",(55% off),₹394
DAVIDOFF,Cool Water Um Male Perfume,4.3,22,"₹4,700",N/A,N/A,"₹3,572"
DAVIDOFF,Cool Water Reborn Eau De Parfum for Men,4.2,54,"₹5,750",N/A,N/A,"₹4,370"
AZZARO,Sport Eau De Toilette,4.3,25,"₹3,000",N/A,N/A,"₹2,220"
AJMAL,Aristocrat Edp - 75 ml,4.1,38,"₹4,000","₹5,000",(20% off),"₹3,000"
CALVIN KLEIN,Defy Eau De Parfum,4.4,9,"₹4,225","₹6,500",(35% off),"₹4,125"
AZZARO,The Most Wanted Eau De Parfum Intense Spray,4.2,35,"₹6,900",N/A,N/A,"₹5,106"
CALVIN KLEIN,One Eau De Toilette & Deodorant Spray for Men Set,N/A,N/A,"₹3,315","₹5,100",(35% off),"₹3,215"
Ulric De Varens,Blue Eau de Toilette 100 ml,2.9,18,₹999,"₹1,175",(15% off),₹764
Reebok,Men Eau de Toilette Cool Your Body for Men,3.5,49,₹500,₹999,(50% off),₹380
Embark,Men My Life Intense for Him Oriental & Woody Luxury Eau De Parfum,4.2,16,"₹1,496","₹1,995",(25% off),"₹1,157"
PRADA,Luna Rossa Ocean EDP,4,5,"₹9,900",N/A,N/A,"₹7,900"
CALVIN KLEIN,Eternity Eau De Toilette,4.4,33,"₹3,868","₹5,950",(35% off),"₹3,768"
Beardo,Whisky Smoke Bourbon Eau De Parfum,3.9,353,₹300,₹999,(70% off),₹277
AJMAL,Blu Edp Aquatic Woody Perfume For Men & Carbon Edp Citrus Spicy Perfume For Men + 2 Parfum Testers,4.7,3,"₹3,600","₹4,500",(20% off),"₹2,880"
VILLAIN,Hydra Eau De Parfum Premium Long Lasting Fragrance Spray - Aquatic,N/A,N/A,₹360,₹799,(55% off),₹296
La French,Perfume Gift Set For Men,3.7,7,₹266,"₹1,399",(81% off),N/A
Beardo,Black Musk Eau De Parfum,3.8,198,₹300,₹999,(70% off),₹277
PRADA,Luna Rossa Black Eau De Parfum,4.6,20,"₹9,900",N/A,N/A,"₹7,900"
Ulric De Varens,Black Eau de Toilette 100 ml,3.8,14,₹999,"₹1,175",(15% off),₹752
Beardo,Men Godfather Eau De Parfum,3.9,245,₹292,₹449,(35% off),₹255
VALENTINO,Uomo Eau De Toilette,4.8,12,"₹8,500",N/A,N/A,"₹6,500"
RALPH LAUREN,Polo Red Set - EDT + Body wash After shave balm & Travel bag,N/A,N/A,"₹12,600",N/A,N/A,"₹10,600"
PRADA,Luna Rossa Ocean Eau De Toilette,3.8,14,"₹8,600",N/A,N/A,"₹6,600"
JAGUAR,Classic Motion Eau de Toilette,4.1,32,"₹2,255","₹4,100",(45% off),"₹1,763"
CALVIN KLEIN,One Eau De Toilette,3.8,58,"₹3,153","₹4,850",(35% off),"₹3,053"
Armani,Code Eau De Parfum,N/A,N/A,"₹7,120","₹8,900",(20% off),"₹5,607"
PRADA,Luna Rossa Carbon Eau De Toilette,3,2,"₹6,500",N/A,N/A,"₹5,070"
Beardo,Mafia Eau De Parfum,3.8,123,₹300,₹999,(70% off),₹277
WILD STONE,Perfume Gift Set of Whisky Cigar and Ammo Perfume for Men,3.4,23,₹355,₹645,(45% off),₹284
Jack & Jones,Blue Heritage Eau De Toilette Perfume,4,6,"₹2,399","₹2,999",(20% off),"₹2,063"
AZZARO,Chrome Parfum,4.8,5,"₹6,780",N/A,N/A,"₹5,017"
Beardo,Dark Side Eau De Parfum,4,319,₹525,"₹1,500",(65% off),₹459
Beardo,Men Legacy & Godfather Deo Spray Set,4.1,36,₹214,₹648,(67% off),₹194
AJMAL,Blu EDP 90 ml,3.8,154,"₹2,400","₹3,000",(20% off),"₹1,740"
POLICE,Deep Blue Eau De Toilette,5,10,"₹2,240","₹3,200",(30% off),"₹1,760"
NIKE,Hub Man Eau De Toilette for Men,N/A,N/A,₹918,₹998,(8% off),₹749
AZZARO,Pour Homme Eau De Toilette,4.2,11,"₹5,350",N/A,N/A,"₹3,959"
LACOSTE,Heritage Essential Eau de Toilette,N/A,N/A,"₹4,400",N/A,N/A,"₹3,432"
NAUTICA,Voyage Man Eau De Toilette,4.2,90,"₹2,340","₹3,900",(40% off),"₹2,145"
DAVIDOFF,Cool Water Reborn Eau De Parfum for Men,4.3,9,"₹4,400",N/A,N/A,"₹3,344"
CALVIN KLEIN,Be Eau De Toilette,4.1,33,"₹3,055","₹4,700",(35% off),"₹2,955"
CALVIN KLEIN,Defy Eau De Parfum,N/A,N/A,"₹3,640","₹5,600",(35% off),"₹3,540"
SNITCH,Men Woody Fragrance Long Lasting Parfume,N/A,N/A,₹824,"₹1,499",(45% off),₹724
Jack & Jones,02-Blue Eau De Toilette Perfume,N/A,N/A,"₹1,749","₹2,499",(30% off),"₹1,474"
ADIDAS,Uefa N9 Eau De Toilette for Men,4.5,11,"₹1,319","₹1,499",(12% off),"₹1,049"
TOMMY HILFIGER,Impact Intense Eau De Parfumfor Men,5,4,"₹4,895","₹8,900",(45% off),"₹3,827"
OMBRE BLISS,Men Vicious Long-Lasting Perfume 100ml,N/A,N/A,"₹1,079","₹1,199",(10% off),₹923
MAMAEARTH,Into the Waves Eau De Parfum For Men,N/A,N/A,₹629,₹899,(30% off),₹450
RALPH LAUREN,Polo Black Eau De Toilette,3.6,5,"₹5,400",N/A,N/A,"₹3,996"
WILD STONE,Code Terra Eau De Parfum,4.2,51,₹650,"₹1,299",(50% off),₹455
AJMAL,Prose Eau De Parfum- 100 ml,3.9,67,₹675,"₹1,500",(55% off),₹570
RALPH LAUREN,Polo Blue Eau De Parfum,3.7,3,"₹6,000",N/A,N/A,"₹4,500"
The Man Company,Night Eau De Parfum,4.1,34,₹412,₹749,(45% off),₹345
AJMAL,Carbon EDP 100 ml,3.8,53,"₹1,200","₹1,500",(20% off),₹915
VILLAIN,Exotic OUD Luxury Premium Long Lasting Fragrance Eau De Perfum for Men,N/A,N/A,₹219,₹399,(45% off),₹184
PARK AVENUE,Harmony Eau De Parfum,3.5,22,₹659,₹749,(12% off),₹577
La French,Kombat Eau De Parfum For Men,3.1,7,₹189,₹650,(71% off),N/A
CALVIN KLEIN,Eternity Aromatic Essence Perfume for Men,4.7,7,"₹4,485","₹6,900",(35% off),"₹4,385"
La French,Mortal Eau De Parfum For Men,3.2,5,₹189,₹650,(71% off),N/A
AJMAL,Impress By Ajmal 10 ml,4.1,36,₹300,₹500,(40% off),₹250
Jack & Jones,01-White Eau De Toilette Perfume,1.5,4,"₹1,999","₹2,499",(20% off),"₹1,719"
ADEN,Aden Oud Aswad Perfume Spray,2.3,3,"₹1,590","₹3,000",(47% off),"₹1,230"
CALVIN KLEIN,Eternity Eau De Toilette,3.9,7,"₹2,990","₹4,600",(35% off),"₹2,890"
WILD STONE,Code Acqua Terra Pyro Premium Eau De Parfum for Men,4.4,16,₹549,₹999,(45% off),₹480
AJMAL,Dahnul Oudh Raashid CP,3.5,11,"₹2,550","₹3,000",(15% off),"₹1,860"
Whiskers,Pandora Eau De Parfum for Men,N/A,N/A,₹779,"₹1,199",(35% off),₹623
Ustraa,Scuba Cologne Perfume,3.9,75,₹575,₹899,(36% off),₹403
The Man Company,Sky Eau De Parfum,4.2,22,₹449,₹749,(40% off),₹375
CALVIN KLEIN,All Eau De Toilette,4.4,9,"₹3,868","₹5,950",(35% off),"₹3,768"
ENGAGE,L'amante Aqua Eau De Parfum For Man,4.1,8,₹859,₹999,(14% off),₹601
Beardo,Whisky Smoke Eau De Parfum,4,671,₹540,"₹1,200",(55% off),₹472
Reebok,Men Eau de Toilette Move Your Spirit for Men,N/A,N/A,₹500,₹999,(50% off),₹437
AJMAL,Classic Oud Concentrated Perfume Oil Woody Oudh Alcohol-Free Attar For Unisex And Cd 99 Mukhallat Concentrated Perfume Oil Floral Oriental Alcohol-Free Attar For Unisex + 2 Parfum Testers,N/A,N/A,"₹2,275","₹3,250",(30% off),"₹1,658"
Beardo,Deodorant Gift Box Set,3.8,8,₹322,₹947,(66% off),₹284
Beardo,Men Iceman Darkside & Spy Body Spray Set,3.8,16,₹319,₹997,(68% off),₹295
Beardo,Men Spy Mafia & Don Most Wanted Body Spray Set,4.3,53,₹322,₹947,(66% off),₹284
TOMMY HILFIGER,Impact Eau De Toilette for Men,N/A,N/A,"₹4,455","₹8,100",(45% off),"₹3,726"
ADEN,Aden Proximity Perfume Spray,2.7,3,"₹1,590","₹3,000",(47% off),"₹1,230"
Beardo,Legend Perfume Eau De Parfum for Men,4.2,25,₹540,"₹1,200",(55% off),₹472
AJMAL,Asher Concentrated Perfume Oil Oriental Alcohol-Free Attar For Unisex Mizyaan Concentrated Perfume Oil Oriental Musky Alcohol-Free Attar,3.8,5,"₹2,600","₹3,250",(20% off),"₹2,080"
METAMAN,Men Extrait De Perfume,N/A,N/A,₹999,N/A,N/A,₹899
Beardo,Whisky Smoke Single Malt Eau De Parfum,4.4,48,₹588,"₹1,200",(51% off),₹514
Embark,Men My Life for Him Citrus & Ambery Luxury Eau De Parfum,4.3,22,"₹1,402","₹1,895",(26% off),"₹1,099"
Bombay Shaving Company,Premium Long Lasting Fragrance Starter kit For Men,2.7,7,₹344,₹649,(47% off),₹301
POLICE,Contemporary Extreme Eau De Toilette for Man,4.1,9,"₹1,600","₹3,200",(50% off),"₹1,312"
ADEN,Men Mystic Tribe Perfume Spray,N/A,N/A,"₹1,590","₹3,000",(47% off),"₹1,230"
DJOKR,Men Perfume Gift Set,3.3,3,₹509,₹849,(40% off),₹356
ADIDAS,Ice Dive Eau De Toilette for Men,3.7,13,"₹1,319","₹1,499",(12% off),"₹1,049"
ADIDAS,Victory League Eau De Toilette for Men,3.4,9,"₹1,319","₹1,499",(12% off),"₹1,049"
Beardo,Tsunami Eau De Parfum,4,154,₹540,"₹1,200",(55% off),₹472
AJMAL,Titanium EDP 100 ml,4,41,"₹1,200","₹1,500",(20% off),₹885
POLICE,To Be Tattoo Art Eau De Toilette,5,4,"₹2,200","₹2,750",(20% off),"₹1,733"
FOGG,Xtremo Eau De Parfum,4,19,₹650,N/A,N/A,₹501
Denver,Rider Eau De Parfum,4.1,10,₹335,₹399,(16% off),₹235
Cantabil,Cantabil Desire Eau De Toilette Perfume,4.1,8,₹609,₹999,(39% off),₹533
NISARA,Game Changer Long Lasting Ambery Woody Fruity EDP for Men,N/A,N/A,₹650,N/A,N/A,₹462
The Man Company,A Gentleman’s Moods Premium Fragrance Gift Set,3.9,42,₹548,₹996,(45% off),₹448
AJMAL,Pack of 2 Blu and Wisal Dhahab Deodorants,4.1,185,₹319,₹798,(60% off),₹263
Ulric De Varens,Eau de Toilette 100 ml,3.4,23,₹999,"₹1,175",(15% off),₹764
The Man Company,Black Eau De Toilette Perfume for Men,4.1,17,₹857,"₹2,598",(67% off),₹779
VILLAIN,Legacy Classic Luxury Premium Long Lasting Fragrance Eau de Perfum for Men,N/A,N/A,₹219,₹399,(45% off),₹184
VILLAIN,Hurricane Hydra Luxury Premium Long Lasting Fragrance Eau De Parfum for Men,N/A,N/A,₹219,₹399,(45% off),₹184
MARYAJ,Deuce Homme Eau De Perfume - 100 ml,3.8,8,₹742,"₹1,649",(55% off),₹577
Beardo,Men Godfather Mafia & Maverick Deo Spray Set,3.6,41,₹319,₹997,(68% off),₹295
Cantabil,Mystic Eau-de Toilette Perfume,3.9,42,₹609,₹999,(39% off),₹533
DEMI DIEUS,Set of 4 Men Eau De Parfume,3.5,2,₹345,"₹1,499",(77% off),₹319
La French,LA' French Classic Eau De Parfum Gift Set,N/A,N/A,₹314,₹849,(63% off),₹275
Ustraa,Ammunition Cologne Perfume,3.9,59,₹575,₹899,(36% off),₹403
Cantabil,Marine Eau-De Toilette Unisex Perfume - 100ml,3.8,19,₹609,₹999,(39% off),₹533
ALFA ROMEO,Blue Eau De Toilette,N/A,N/A,"₹1,750",N/A,N/A,"₹1,348"
Mcaffeine,Fien Men Written By Women Perfume Gift Set for Men,4,3,₹615,₹799,(23% off),₹431
WILD STONE,Night Rider Eau De Parfum for Men,3.7,17,₹199,₹249,(20% off),₹174
AJMAL,Selfie By Ajmal 10 ml,3.9,30,₹300,₹500,(40% off),₹250
SENTIRE,Men Casanova Long Lasting Parfum,N/A,N/A,₹646,₹680,(5% off),₹558
AJMAL,Musk Amber Concentrated Perfume for Men,4.1,18,₹450,₹500,(10% off),₹355
VILLAIN,Unstoppable Mischief Premium Long Lasting Fragrance Eau de Perfum for Men,N/A,N/A,₹219,₹399,(45% off),₹184
WILD STONE,No Gas Perfume Body Spray Pack,4.3,7,₹423,₹650,(35% off),₹345
Beardo,Black Musk Perfume,3.7,234,₹540,"₹1,200",(55% off),₹472
The Man Company,Tranquil Eau De Parfum,4,9,₹449,₹749,(40% off),₹375
DEMI DIEUS,Men Rose Spiced EDP Fragrance 100ML,N/A,N/A,₹312,"₹1,249",(75% off),₹288
The Man Company,Ombre Eau De Parfum,3.9,21,₹270,₹599,(55% off),₹236
Yardley London,Elegance Body Spray for Men,3,2,₹248,₹330,(25% off),₹201
The Man Company,Body Parfum - Bleu,3.6,27,₹299,₹399,(25% off),₹243
NEUD,Milan Da Vinci Luxury Perfume for Cosmopolitan Men Long Lasting Eau de Parfum,N/A,N/A,₹799,N/A,N/A,₹591
Whiskers,Enchanted Eau De Parfum for Men,N/A,N/A,₹519,₹799,(35% off),₹431
DEMI DIEUS,Men Sweet and Warm Luxery Perfume,N/A,N/A,₹312,"₹1,249",(75% off),₹288
Soul & Scents,"SOUL & SCENTS HFS /SS/FRES_PO3, Onesize",N/A,N/A,₹191,₹299,(36% off),₹150
DEMI DIEUS,Set of 4 Men Eau De Parfume Gift Set,N/A,N/A,₹345,"₹1,499",(77% off),₹319
La French,Shield Eau De Parfum For Men,3.5,6,₹189,₹650,(71% off),N/A
PRADA,L'Homme Eau De Toilette,4.8,23,"₹9,000",N/A,N/A,"₹7,000"
AJMAL,Pack of 2 Blu Parfum Deodorants,3.5,11,₹319,₹798,(60% off),₹263
Beardo,Don Perfume Eau De Parfum for Men,3.3,8,₹181,₹349,(48% off),₹158
PRADA,Luna Rossa Ocean Eau De Toilette,5,8,"₹6,500",N/A,N/A,"₹4,810"
ENGAGE,Luxury Travel Sized Gift Pack Eau De Perfume for Men,4.3,9,₹739,₹999,(26% off),₹517
AZZARO,Chrome 22 Eau De Parfum,5,2,"₹6,400",N/A,N/A,"₹4,800"
AJMAL,Asher for Unisex - 12 ml,4.2,16,₹875,"₹1,250",(30% off),₹650
WILD STONE,Code Acqua Eau De Parfum,3.7,61,₹650,"₹1,299",(50% off),₹455
CALVIN KLEIN,All Eau De Toilette,3.8,8,"₹3,055","₹4,700",(35% off),"₹2,955"
AZZARO,The Most Wanted Eau De Toilette Intense for Men,N/A,N/A,"₹6,760",N/A,N/A,"₹5,002"
AZZARO,Wanted Eau De Toilette,4.2,5,"₹7,100",N/A,N/A,"₹5,254"
AJMAL,Bastion EDP 100 ml,4.2,16,"₹1,200","₹1,500",(20% off),₹870
ADEN,Aden Kabul Night Perfume Spray,N/A,N/A,"₹1,590","₹3,000",(47% off),"₹1,230"
NAUTICA,Pure Blue Eau De Toilette for Men,N/A,N/A,"₹2,340","₹3,900",(40% off),"₹2,145"
PRADA,Luna Rossa Eau De Toilette,4.3,6,"₹8,600",N/A,N/A,"₹6,600"
AJMAL,Amber Santal Eau De Parfum- 100 ml,4.1,14,"₹8,400","₹14,000",(40% off),"₹6,400"
RALPH LAUREN,Polo Eau De Toilette,5,3,"₹5,400",N/A,N/A,"₹3,996"
ADIDAS,Dynamic Pulse Eau De Toilette for Men,4,6,"₹1,319","₹1,499",(12% off),"₹1,049"
RALPH LAUREN,Ralph's Club Parfum,3.8,6,"₹9,900",N/A,N/A,"₹7,900"
Tonino Lamborghini,Intenso Eau De Toilette,N/A,N/A,"₹2,300",N/A,N/A,"₹1,771"
Yardley London,Gentleman Royale Daily Wear Perfume,3.9,41,₹643,₹649,(1% off),₹552
AZZARO,Pour Homme Eau De Toilette,3.6,5,"₹4,000",N/A,N/A,"₹2,960"
Tonino Lamborghini,Mitico Eau De Toilette,N/A,N/A,"₹2,300",N/A,N/A,"₹1,748"
CALVIN KLEIN,Eternity Eau De Parfum for Men,3,2,"₹3,023","₹4,650",(35% off),"₹2,923"
Beardo,Assorted Premium Perfume Gift Set,3.6,77,₹363,₹699,(48% off),₹318
GUESS,Seductive Homme Blue Eau de Toilette -100 ml,4,14,"₹3,825","₹5,100",(25% off),"₹2,958"
Daniel Klein,Daniel Klein Oasis Eau De Parfum 100 ml,N/A,N/A,"₹1,290","₹3,250",(60% off),"₹1,073"
PARK AVENUE,Conquer Eau De Parfum,3.9,9,₹371,₹399,(7% off),₹283
POLICE,To Be Freetodare Eau De Toilette for Men,3.7,3,"₹2,200","₹2,750",(20% off),"₹1,760"
METAMAN,Men Extrait De Perfume,5,2,₹999,N/A,N/A,₹899
JOVAN MUSK,White Musk Eau De Cologne Perfume,N/A,N/A,"₹1,238","₹1,650",(25% off),₹867
DEMI DIEUS,Set of 2 Men Eau De Parfume,N/A,N/A,₹261,₹899,(71% off),N/A
SENTIRE,Casanova Fruity Long Lasting Perfume,N/A,N/A,₹475,₹500,(5% off),₹410
The Man Company,Set of 3 Privilege Legend with Bold & Active Body Sprays,3.6,16,₹475,₹897,(47% off),₹404
Embark,Men My Life for Him Citrus & Ambery Luxury Eau De Parfum,4,11,₹608,₹845,(28% off),₹499
EDW Essenza,Mikkel Verde Eau De Toilette,4.7,3,"₹3,230","₹4,250",(24% off),"₹2,593"
AJMAL,Artisan - Oudh Smear Long Lasting Hand Picked Luxury Perfume for Men,3.1,8,₹503,₹899,(44% off),₹405
COLOUR ME,Homme Green Eau De Parfum,3.7,7,₹699,N/A,N/A,₹545
The Man Company,Joy Eau De Parfum,4.2,26,₹675,"₹1,499",(55% off),₹591
DEMI DIEUS,Set of 4 Men Eau De Parfume Gift Set,N/A,N/A,₹345,"₹1,499",(77% off),₹319
COLOUR ME,Homme Abstract Art Eau De Parfum,4,8,₹699,N/A,N/A,₹545
Whiskers,Haunted Eau De Parfum for Men,N/A,N/A,₹649,₹999,(35% off),₹568
PARK AVENUE,Pack of 4 Luxury Men Perfume Gift Set for Men,4.7,3,₹747,₹849,(12% off),₹535
Beardo,Godfather Solid Perfume for Men,N/A,N/A,₹374,₹499,(25% off),₹327
TABAC,Original Eau De Toilette Natural Spray,3.5,6,"₹1,920","₹2,400",(20% off),"₹1,512"
Reebok,Men Eau de Toilette Inspire Your Mind for Men,3.5,26,₹500,₹999,(50% off),₹437
Pilgrim,The Impressions Collection 3 In 1 EDP Gift Box,N/A,N/A,₹519,₹799,(35% off),₹363
FW FAUN WALK,Men Long-Lasting Minimalist Perfume,N/A,N/A,₹664,₹699,(5% off),₹573
Beardo,Don & Mariner Eau De Parfum Set for Men,3.9,9,₹270,₹599,(55% off),₹236
Beardo,Legendary 7 Assorted Perfume Gift Set,3.1,20,₹550,"₹1,099",(50% off),₹481
ENGAGE,Mate Deodorant Spray Combo for Men,3.8,9,₹350,N/A,N/A,₹252
Beardo,Mariner Eau De Parfum for Men,4,5,₹181,₹349,(48% off),₹158
RIFFWAY,Men Angel Perfume Long-Lasting Natural Fragrance,N/A,N/A,₹220,₹999,(78% off),N/A
Beardo,Pack of 2 Whisky Smoke & Bourbon Long Lasting Deo Body Spray Combo For Men,4,4,₹216,₹698,(69% off),₹203
The Man Company,Men Polo Red Eau De Parfum,3.9,10,₹494,₹899,(45% off),₹405
La French,War Zone Eau De Parfum For Men,3.7,13,₹189,₹650,(71% off),N/A
Beardo,Pack of 3 Power Lust & Glory Long Lasting Deo Body Spray For Men,N/A,N/A,₹314,"₹1,047",(70% off),₹290
Envy,Men Envy Bold Eau De Parfum,2.6,16,₹251,₹299,(16% off),₹179
Armaf,Club De Nuit Sillage Eau De Parfum,4.5,4,"₹5,360",N/A,N/A,"₹3,752"
Armaf,Aura Eau De Parfum,4.5,2,"₹2,350",N/A,N/A,"₹1,692"
Armaf,Club De Nuit Intense Eau De Toilette,4.1,8,"₹4,750",N/A,N/A,"₹3,373"
Armaf,Tres Nuit Pour Homme Eau De Toilette,N/A,N/A,"₹2,295",N/A,N/A,"₹1,836"
Armaf,Hunter Intense Eau De Toilette,3.8,15,"₹2,490",N/A,N/A,"₹1,768"
Beardo,Fantastic Four Perfume Deodorant Set,2.6,111,₹268,₹596,(55% off),₹234
Beardo,Blue Blood Perfume Eau de Parfum for Men,N/A,N/A,"₹1,200","₹2,000",(40% off),"₹1,080"
Dorall Collection,Islanders Eau De Toilette,N/A,N/A,₹300,₹599,(50% off),₹262
JAGUAR,Classic Eau de Toilette -40 ml,4.5,2,"₹1,560","₹2,400",(35% off),"₹1,296"
Beardo,Godfather Eau De Parfum for Men,3.8,12,₹181,₹349,(48% off),₹158
WILD STONE,Whiskey Eau De Parfum,3.6,27,₹439,₹799,(45% off),₹336
Dorall Collection,Hunted Eau De Toilette,N/A,N/A,₹300,₹599,(50% off),₹262
CALVIN KLEIN,Eternity Men Giftset - Eau De Toilette 100 ml + Deodorant 150 ml,N/A,N/A,"₹5,330","₹8,200",(35% off),"₹5,230"
NAUTICA,Blue Eau de Toilette -100 ml,4,26,"₹1,920","₹3,200",(40% off),"₹1,760"
S Oliver,Pure Sense Men Eau De Toilette,N/A,N/A,₹910,"₹1,400",(35% off),₹784
Viktor & Rolf,Viktor and Rolf Spicebomb Night Vision Eau De Toilette for Men,N/A,N/A,"₹8,150",N/A,N/A,"₹6,357"
Jacques Bogart,Pour Homme Eau de Toilette - 100 ml,3.3,20,"₹2,750","₹5,000",(45% off),"₹2,150"
Beardo,Whiskey Smoke & Godfather Eau De Parfum Set for Men,4.3,16,₹741,"₹1,398",(47% off),₹648
The Man Company,Black EDT- 50 ml,4.8,4,₹468,"₹1,299",(64% off),₹409
Embark,Men My Freedom for Him Fougere & Fresh Luxury Eau De Parfum,3.8,5,₹456,₹845,(46% off),₹397
JAGUAR,Classic Black Eau de Toilette -40 ml,4.2,26,"₹2,340","₹3,600",(35% off),"₹1,836"
Beardo,White Opium Perfume Eau de parfum for Men,4.3,3,"₹1,299","₹1,999",(35% off),"₹1,139"
Bella Vita Organic,Luxury Klub Eau De Parfum,3.7,53,₹599,₹799,(25% off),₹423
The Man Company,Blanc Eau De Toilette,4.1,39,₹494,₹899,(45% off),₹405
ARAMIS,Classic Eau De Toilette,4.1,16,"₹3,150","₹4,200",(25% off),"₹2,436"
AZZARO,Chrome Eau De Toilette,4.8,10,"₹4,500",N/A,N/A,"₹3,330"
TOMMY HILFIGER,Now Eau de Toilette - 30 ml,4.5,8,"₹1,860","₹3,100",(40% off),"₹1,457"
DAVIDOFF,Cool Water Reborn Eau De Toilette for Him,3.8,18,"₹4,250",N/A,N/A,"₹3,230"
WILD STONE,Ultra Sensual Fragrance Combo for Men,4.3,17,₹406,₹624,(35% off),₹324
CALVIN KLEIN,Defy Eau De Toilette,5,4,"₹4,323","₹6,650",(35% off),"₹4,223"
GUESS,Uomo Eau De Toilette,4,4,"₹4,800","₹6,400",(25% off),"₹3,648"
POLICE,To Be The King Eau De Toilette - 125 ml,4.4,10,"₹2,870","₹4,100",(30% off),"₹2,214"
Embark,Men Ananda for Him Aromatic & Aquatic Luxury Eau De Parfum,4.3,3,"₹2,624","₹3,595",(27% off),"₹2,013"
Beardo,Pack of 2 Glory & Pride Long Lasting Deo Body Spray Combo for Men,N/A,N/A,₹216,₹698,(69% off),₹203
CALVIN KLEIN,Euphoria Eau De Toilette,3.9,15,"₹4,420","₹6,800",(35% off),"₹4,320"
RALPH LAUREN,Polo Red Eau De Parfum,N/A,N/A,"₹6,300",N/A,N/A,"₹4,788"
CALVIN KLEIN,Defy Eau De Parfum,3,2,"₹4,950",N/A,N/A,"₹3,812"
CALVIN KLEIN,Everyone Eau De Toilette,2,4,"₹3,218","₹4,950",(35% off),"₹3,118"
GUESS,1981 Indigo Eau De Toilette for Men,N/A,N/A,"₹2,665","₹4,100",(35% off),"₹2,173"
AZZARO,Chrome 22 Eau De Parfum,4.3,3,"₹4,860",N/A,N/A,"₹3,596"
TOMMY HILFIGER,Now Eau de Toilette - 100 ml,3.1,16,"₹3,480","₹5,800",(40% off),"₹2,726"
The Man Company,The Multifaceted No Gas Body Perfume Combo,5,2,"₹1,037","₹1,596",(35% off),₹814
Bentley,Men Infinite Intense Eau De Parfum,4.4,13,"₹6,825","₹9,100",(25% off),"₹5,187"
Ustraa,Base Camp Cologne Perfume,3.9,185,₹575,₹899,(36% off),₹403
PARK AVENUE,Euphoria Eau De Parfum,3.8,68,₹703,₹799,(12% off),₹615
HRX,Extreme for Men Eau De Toilette,4,4,"₹1,520","₹1,900",(20% off),"₹1,140"
Denver,Sporting Club League Eau De Parfum Body Spray,4.2,5,₹293,₹349,(16% off),₹213
AJMAL,Silver Shade Edp Citrus Woody Perfume For Men & Kuro Edp Aromatic Spicy Perfume For Men + 2 Parfum Testers,N/A,N/A,"₹4,000","₹5,000",(20% off),"₹2,850"
Jacques Bogart,Jacques Bogart One Man Show Eau de Toilette -100 ml,3.3,21,"₹1,650","₹3,300",(50% off),"₹1,320"
St.john,Blackberry Eau De Parfum,3.5,8,₹999,N/A,N/A,₹769
Beardo,Whisky Smoke Eau De Parfum,3.9,56,"₹1,099","₹1,999",(45% off),₹980
Ustraa,Vibe Eau De Toilette,4,6,₹374,₹499,(25% off),₹274
WILD STONE,Forest Spice Eau De Parfum,3.9,56,₹279,₹399,(30% off),₹227
PARK AVENUE,Conquer Eau De Parfum,3.9,27,₹703,₹799,(12% off),₹615
PRADA,Luna Rossa Sport Eau De Toilette,3.5,4,"₹6,500",N/A,N/A,"₹4,810"
UrbanGabru,Beast Eau De Parfum,3.6,5,₹500,₹999,(50% off),₹420
ENGAGE,Indigo Skies Eau De Parfum with Free Tester,3.7,14,₹526,₹649,(19% off),₹368
The Man Company,Polo Black Eau De Parfum for Men,3.6,11,₹494,₹899,(45% off),₹414
NAUTICA,Voyage Sport Eau de Toilette for Men,N/A,N/A,"₹2,340","₹3,900",(40% off),"₹1,950"
AZZARO,The Most Wanted Eau De Toilette Intense for Men,N/A,N/A,"₹9,000",N/A,N/A,"₹7,000"
JAGUAR,Classic Gold Eau de Toilette,4.3,52,"₹2,870","₹4,100",(30% off),"₹2,255"
POLICE,Cosmopolitan Eau de Toilette -100 ml,3.6,43,"₹1,920","₹3,200",(40% off),"₹1,504"
Beardo,Men Assorted Tsunami Black Musk Mariner & Don Eau De Parfum,3.9,16,₹540,"₹1,200",(55% off),₹472
POLICE,Original Eau de Toilette - 100 ml,3.5,8,"₹1,760","₹3,200",(45% off),"₹1,376"
JAGUAR,Classic Electric Sky Eau De Toilette,4.1,30,"₹2,460","₹4,100",(40% off),"₹1,927"
DAVIDOFF,Cool Water Reborn Eau de Parfum Intense for Men,N/A,N/A,"₹4,650",N/A,N/A,"₹3,627"
DAVIDOFF,Eau De Toilette Spray,3.9,17,"₹4,600",N/A,N/A,"₹3,496"
Beardo,Mariner & Freed Marina Bae Eau De Parfum Set for Men,3.6,5,₹270,₹599,(55% off),₹236
PORSCHE,Titan M Eau De Toilette - 50 ml,N/A,N/A,"₹5,355","₹6,300",(15% off),"₹4,095"
AZZARO,Chrome Parfum,N/A,N/A,"₹5,090",N/A,N/A,"₹3,767"
Beardo,Whisky Smoke Perfume Combo,3.2,20,₹620,"₹1,549",(60% off),₹542
CALVIN KLEIN,Defy Eau De Parfum,N/A,N/A,"₹9,250",N/A,N/A,"₹7,250"
SENTIRE,Men Sentire Dapper Long Lasting Perfume,N/A,N/A,₹475,₹500,(5% off),₹410
ENGAGE,Homme Eau De Parfum For Man,3.7,29,₹454,₹649,(30% off),₹318
RIFFWAY,Angel Chamomile Long-Lasting Perfume,N/A,N/A,₹220,₹999,(78% off),N/A
POLICE,Gentleman Eau De Toilette,4,14,"₹2,560","₹3,200",(20% off),"₹1,984"
RIFFWAY,Men  Citrus Twist Perfume Spray,N/A,N/A,₹220,₹999,(78% off),N/A
